year,subfield_id,subfield_name,id,name,works_count,country,fetch_date
2009,1702,Artificial Intelligence,T10100,Metaheuristic Optimization Algorithms Research,262,JP,2025-11-25 22:06:42
2009,1702,Artificial Intelligence,T11975,Evolutionary Algorithms and Applications,256,JP,2025-11-25 22:06:42
2009,1702,Artificial Intelligence,T10201,Speech Recognition and Synthesis,255,JP,2025-11-25 22:06:42
2009,1702,Artificial Intelligence,T12031,Speech and dialogue systems,253,JP,2025-11-25 22:06:42
2009,1702,Artificial Intelligence,T11130,Coding theory and cryptography,230,JP,2025-11-25 22:06:42
2009,1702,Artificial Intelligence,T10237,Cryptography and Data Security,225,JP,2025-11-25 22:06:42
2009,1702,Artificial Intelligence,T11269,Algorithms and Data Compression,212,JP,2025-11-25 22:06:42
2009,1702,Artificial Intelligence,T13083,Advanced Text Analysis Techniques,202,JP,2025-11-25 22:06:42
2009,1702,Artificial Intelligence,T10682,Quantum Computing Algorithms and Architecture,189,JP,2025-11-25 22:06:42
2009,1702,Artificial Intelligence,T10860,Speech and Audio Processing,176,JP,2025-11-25 22:06:42
2009,1702,Artificial Intelligence,T10462,Reinforcement Learning in Robotics,147,JP,2025-11-25 22:06:42
2009,1702,Artificial Intelligence,T12157,Geochemistry and Geologic Mapping,146,JP,2025-11-25 22:06:42
2009,1702,Artificial Intelligence,T13018,Seismology and Earthquake Studies,146,JP,2025-11-25 22:06:42
2009,1702,Artificial Intelligence,T10622,Quantum Mechanics and Applications,145,JP,2025-11-25 22:06:42
2009,2504,"Electronic, Optical and Magnetic Materials",T10607,Magnetic and transport properties of perovskites and related materials,915,JP,2025-11-25 22:06:42
2009,2504,"Electronic, Optical and Magnetic Materials",T10037,Physics of Superconductivity and Magnetism,655,JP,2025-11-25 22:06:42
2009,2504,"Electronic, Optical and Magnetic Materials",T11682,Advanced Condensed Matter Physics,581,JP,2025-11-25 22:06:42
2009,2504,"Electronic, Optical and Magnetic Materials",T10612,Magnetism in coordination complexes,572,JP,2025-11-25 22:06:42
2009,2504,"Electronic, Optical and Magnetic Materials",T11766,Iron-based superconductors research,535,JP,2025-11-25 22:06:42
2009,2504,"Electronic, Optical and Magnetic Materials",T11222,Magnetic Properties and Applications,482,JP,2025-11-25 22:06:42
2009,2504,"Electronic, Optical and Magnetic Materials",T10681,Rare-earth and actinide compounds,458,JP,2025-11-25 22:06:42
2009,2504,"Electronic, Optical and Magnetic Materials",T12529,Ga2O3 and related materials,423,JP,2025-11-25 22:06:42
2009,2504,"Electronic, Optical and Magnetic Materials",T10306,Liquid Crystal Research Advancements,414,JP,2025-11-25 22:06:42
2009,2504,"Electronic, Optical and Magnetic Materials",T11758,Organic and Molecular Conductors Research,409,JP,2025-11-25 22:06:42
2009,2504,"Electronic, Optical and Magnetic Materials",T11661,Copper Interconnects and Reliability,404,JP,2025-11-25 22:06:42
2009,2504,"Electronic, Optical and Magnetic Materials",T10886,Multiferroics and related materials,397,JP,2025-11-25 22:06:42
2009,2504,"Electronic, Optical and Magnetic Materials",T10131,Gold and Silver Nanoparticles Synthesis and Applications,336,JP,2025-11-25 22:06:42
2009,2504,"Electronic, Optical and Magnetic Materials",T10049,Magnetic properties of thin films,327,JP,2025-11-25 22:06:42
2009,2504,"Electronic, Optical and Magnetic Materials",T10090,ZnO doping and properties,292,JP,2025-11-25 22:06:42
2009,2504,"Electronic, Optical and Magnetic Materials",T11782,Magnetic Properties of Alloys,265,JP,2025-11-25 22:06:42
2009,2504,"Electronic, Optical and Magnetic Materials",T10472,Semiconductor materials and devices,247,JP,2025-11-25 22:06:42
2009,2504,"Electronic, Optical and Magnetic Materials",T10179,Supercapacitor Materials and Fabrication,234,JP,2025-11-25 22:06:42
2009,2504,"Electronic, Optical and Magnetic Materials",T10107,Ferroelectric and Piezoelectric Materials,215,JP,2025-11-25 22:06:42
2009,2504,"Electronic, Optical and Magnetic Materials",T12588,Electronic and Structural Properties of Oxides,204,JP,2025-11-25 22:06:42
2009,2211,Mechanics of Materials,T10377,Metal and Thin Film Mechanics,937,JP,2025-11-25 22:06:42
2009,2211,Mechanics of Materials,T11201,Metallurgy and Material Forming,594,JP,2025-11-25 22:06:42
2009,2211,Mechanics of Materials,T10396,Fatigue and fracture mechanics,512,JP,2025-11-25 22:06:42
2009,2211,Mechanics of Materials,T11799,"Adhesion, Friction, and Surface Interactions",460,JP,2025-11-25 22:06:42
2009,2211,Mechanics of Materials,T11854,Laser-induced spectroscopy and plasma,359,JP,2025-11-25 22:06:42
2009,2211,Mechanics of Materials,T10662,Ultrasonics and Acoustic Wave Propagation,326,JP,2025-11-25 22:06:42
2009,2211,Mechanics of Materials,T10478,Diamond and Carbon-based Materials Research,291,JP,2025-11-25 22:06:42
2009,2211,Mechanics of Materials,T12252,Mechanical stress and fatigue analysis,286,JP,2025-11-25 22:06:42
2009,2211,Mechanics of Materials,T10700,Metal Forming Simulation Techniques,282,JP,2025-11-25 22:06:42
2009,2211,Mechanics of Materials,T10219,Mechanical Behavior of Composites,251,JP,2025-11-25 22:06:42
2009,2211,Mechanics of Materials,T12362,Tribology and Wear Analysis,229,JP,2025-11-25 22:06:42
2009,2211,Mechanics of Materials,T12537,Flow Measurement and Analysis,204,JP,2025-11-25 22:06:42
2009,2211,Mechanics of Materials,T10514,Numerical methods in engineering,185,JP,2025-11-25 22:06:42
2009,2211,Mechanics of Materials,T12427,Metal Alloys Wear and Properties,178,JP,2025-11-25 22:06:42
2009,2211,Mechanics of Materials,T10386,Microstructure and Mechanical Properties of Steels,174,JP,2025-11-25 22:06:42
2009,2211,Mechanics of Materials,T10399,Hydrocarbon exploration and reservoir analysis,155,JP,2025-11-25 22:06:42
2009,2211,Mechanics of Materials,T11138,Tribology and Lubrication Engineering,152,JP,2025-11-25 22:06:42
2009,2211,Mechanics of Materials,T12169,Non-Destructive Testing Techniques,145,JP,2025-11-25 22:06:42
2009,2211,Mechanics of Materials,T14156,Engineering Applied Research,137,JP,2025-11-25 22:06:42
2009,2211,Mechanics of Materials,T10221,Composite Structure Analysis and Optimization,129,JP,2025-11-25 22:06:42
2010,2208,Electrical and Electronic Engineering,T10472,Semiconductor materials and devices,1808,JP,2025-11-25 22:06:42
2010,2208,Electrical and Electronic Engineering,T10299,Photonic and Optical Devices,1401,JP,2025-11-25 22:06:42
2010,2208,Electrical and Electronic Engineering,T10232,Optical Network Technologies,844,JP,2025-11-25 22:06:42
2010,2208,Electrical and Electronic Engineering,T10409,Fuel Cells and Related Materials,782,JP,2025-11-25 22:06:42
2010,2208,Electrical and Electronic Engineering,T10558,Advancements in Semiconductor Devices and Circuit Design,765,JP,2025-11-25 22:06:42
2010,2208,Electrical and Electronic Engineering,T11429,Semiconductor Lasers and Optical Devices,733,JP,2025-11-25 22:06:42
2010,2208,Electrical and Electronic Engineering,T10913,Molecular Junctions and Nanostructures,698,JP,2025-11-25 22:06:42
2010,2208,Electrical and Electronic Engineering,T14117,Integrated Circuits and Semiconductor Failure Analysis,627,JP,2025-11-25 22:06:42
2010,2208,Electrical and Electronic Engineering,T10623,Thin-Film Transistor Technologies,609,JP,2025-11-25 22:06:42
2010,2208,Electrical and Electronic Engineering,T10767,Advanced Photonic Communication Systems,591,JP,2025-11-25 22:06:42
2010,2208,Electrical and Electronic Engineering,T10045,Organic Electronics and Photovoltaics,583,JP,2025-11-25 22:06:42
2010,2208,Electrical and Electronic Engineering,T10018,Advancements in Battery Materials,568,JP,2025-11-25 22:06:42
2010,2208,Electrical and Electronic Engineering,T10461,Gas Sensing Nanomaterials and Sensors,541,JP,2025-11-25 22:06:42
2010,2208,Electrical and Electronic Engineering,T10660,Conducting polymers and applications,516,JP,2025-11-25 22:06:42
2010,2208,Electrical and Electronic Engineering,T10022,Semiconductor Quantum Structures and Devices,510,JP,2025-11-25 22:06:42
2010,2208,Electrical and Electronic Engineering,T10781,Plasma Diagnostics and Applications,488,JP,2025-11-25 22:06:42
2010,2208,Electrical and Electronic Engineering,T10361,Silicon Carbide Semiconductor Technologies,449,JP,2025-11-25 22:06:42
2010,2208,Electrical and Electronic Engineering,T10624,Silicon and Solar Cell Technologies,438,JP,2025-11-25 22:06:42
2010,2208,Electrical and Electronic Engineering,T10988,Advanced Fiber Laser Technologies,426,JP,2025-11-25 22:06:42
2010,2208,Electrical and Electronic Engineering,T10502,Advanced Memory and Neural Computing,425,JP,2025-11-25 22:06:42
2010,2505,Materials Chemistry,T10192,Catalytic Processes in Materials Science,940,JP,2025-11-25 22:06:42
2010,2505,Materials Chemistry,T10083,Graphene research and applications,854,JP,2025-11-25 22:06:42
2010,2505,Materials Chemistry,T10090,ZnO doping and properties,843,JP,2025-11-25 22:06:42
2010,2505,Materials Chemistry,T10074,Carbon Nanotubes in Composites,832,JP,2025-11-25 22:06:42
2010,2505,Materials Chemistry,T10478,Diamond and Carbon-based Materials Research,818,JP,2025-11-25 22:06:42
2010,2505,Materials Chemistry,T12588,Electronic and Structural Properties of Oxides,661,JP,2025-11-25 22:06:42
2010,2505,Materials Chemistry,T10107,Ferroelectric and Piezoelectric Materials,562,JP,2025-11-25 22:06:42
2010,2505,Materials Chemistry,T11242,Nuclear Materials and Properties,555,JP,2025-11-25 22:06:42
2010,2505,Materials Chemistry,T10903,Porphyrin and Phthalocyanine Chemistry,553,JP,2025-11-25 22:06:42
2010,2505,Materials Chemistry,T10321,Quantum Dots Synthesis And Properties,501,JP,2025-11-25 22:06:42
2010,2505,Materials Chemistry,T10472,Semiconductor materials and devices,488,JP,2025-11-25 22:06:42
2010,2505,Materials Chemistry,T10377,Metal and Thin Film Mechanics,485,JP,2025-11-25 22:06:42
2010,2505,Materials Chemistry,T10592,Fusion materials and technologies,458,JP,2025-11-25 22:06:42
2010,2505,Materials Chemistry,T10311,Advancements in Solid Oxide Fuel Cells,454,JP,2025-11-25 22:06:42
2010,2505,Materials Chemistry,T11162,Enzyme Structure and Function,449,JP,2025-11-25 22:06:42
2010,2505,Materials Chemistry,T11240,Luminescence and Fluorescent Materials,422,JP,2025-11-25 22:06:42
2010,2505,Materials Chemistry,T10204,Microstructure and mechanical properties,400,JP,2025-11-25 22:06:42
2010,2505,Materials Chemistry,T11169,Silicon Nanostructures and Photoluminescence,399,JP,2025-11-25 22:06:42
2010,2505,Materials Chemistry,T10735,Mesoporous Materials and Catalysis,392,JP,2025-11-25 22:06:42
2010,2505,Materials Chemistry,T10078,Advanced Photocatalysis Techniques,384,JP,2025-11-25 22:06:42
2010,2204,Biomedical Engineering,T11301,Advanced Surface Polishing Techniques,783,JP,2025-11-25 22:06:42
2010,2204,Biomedical Engineering,T10879,Robotic Locomotion and Control,689,JP,2025-11-25 22:06:42
2010,2204,Biomedical Engineering,T11808,Superconducting Materials and Applications,587,JP,2025-11-25 22:06:42
2010,2204,Biomedical Engineering,T10784,Muscle activation and electromyography studies,532,JP,2025-11-25 22:06:42
2010,2204,Biomedical Engineering,T11160,Acoustic Wave Resonator Technologies,527,JP,2025-11-25 22:06:42
2010,2204,Biomedical Engineering,T10059,Bone Tissue Engineering Materials,513,JP,2025-11-25 22:06:42
2010,2204,Biomedical Engineering,T10338,Advanced Sensor and Energy Harvesting Materials,507,JP,2025-11-25 22:06:42
2010,2204,Biomedical Engineering,T10412,Microfluidic and Capillary Electrophoresis Applications,503,JP,2025-11-25 22:06:42
2010,2204,Biomedical Engineering,T11272,Nanowire Synthesis and Applications,426,JP,2025-11-25 22:06:42
2010,2204,Biomedical Engineering,T12224,Nanofabrication and Lithography Techniques,418,JP,2025-11-25 22:06:42
2010,2204,Biomedical Engineering,T10868,Soft Robotics and Applications,411,JP,2025-11-25 22:06:42
2010,2204,Biomedical Engineering,T11667,Advanced Chemical Sensor Technologies,402,JP,2025-11-25 22:06:42
2010,2204,Biomedical Engineering,T11255,Microfluidic and Bio-sensing Technologies,387,JP,2025-11-25 22:06:42
2010,2204,Biomedical Engineering,T10171,Biofuel production and bioconversion,359,JP,2025-11-25 22:06:42
2010,2204,Biomedical Engineering,T11023,Prosthetics and Rehabilitation Robotics,338,JP,2025-11-25 22:06:42
2010,2204,Biomedical Engineering,T11190,3D Printing in Biomedical Research,337,JP,2025-11-25 22:06:42
2010,2204,Biomedical Engineering,T11407,Innovative Microfluidic and Catalytic Techniques Innovation,327,JP,2025-11-25 22:06:42
2010,2204,Biomedical Engineering,T12386,Advanced X-ray and CT Imaging,270,JP,2025-11-25 22:06:42
2010,2204,Biomedical Engineering,T10653,Robot Manipulation and Learning,269,JP,2025-11-25 22:06:42
2010,2204,Biomedical Engineering,T10323,Analog and Mixed-Signal Circuit Design,249,JP,2025-11-25 22:06:42
2010,2210,Mechanical Engineering,T10717,Aluminum Alloys Composites Properties,620,JP,2025-11-25 22:06:42
2010,2210,Mechanical Engineering,T12784,Modular Robots and Swarm Intelligence,576,JP,2025-11-25 22:06:42
2010,2210,Mechanical Engineering,T10386,Microstructure and Mechanical Properties of Steels,494,JP,2025-11-25 22:06:42
2010,2210,Mechanical Engineering,T11201,Metallurgy and Material Forming,474,JP,2025-11-25 22:06:42
2010,2210,Mechanical Engineering,T11687,Teleoperation and Haptic Systems,450,JP,2025-11-25 22:06:42
2010,2210,Mechanical Engineering,T10700,Metal Forming Simulation Techniques,422,JP,2025-11-25 22:06:42
2010,2210,Mechanical Engineering,T10188,Advanced machining processes and optimization,382,JP,2025-11-25 22:06:42
2010,2210,Mechanical Engineering,T12099,Advanced materials and composites,377,JP,2025-11-25 22:06:42
2010,2210,Mechanical Engineering,T12169,Non-Destructive Testing Techniques,367,JP,2025-11-25 22:06:42
2010,2210,Mechanical Engineering,T10670,Aluminum Alloy Microstructure Properties,347,JP,2025-11-25 22:06:42
2010,2210,Mechanical Engineering,T10396,Fatigue and fracture mechanics,324,JP,2025-11-25 22:06:42
2010,2210,Mechanical Engineering,T11301,Advanced Surface Polishing Techniques,319,JP,2025-11-25 22:06:42
2010,2210,Mechanical Engineering,T11138,Tribology and Lubrication Engineering,305,JP,2025-11-25 22:06:42
2010,2210,Mechanical Engineering,T10633,Metallic Glasses and Amorphous Alloys,300,JP,2025-11-25 22:06:42
2010,2210,Mechanical Engineering,T10723,Advanced Welding Techniques Analysis,298,JP,2025-11-25 22:06:42
2010,2210,Mechanical Engineering,T11372,Hydraulic and Pneumatic Systems,298,JP,2025-11-25 22:06:42
2010,2210,Mechanical Engineering,T10834,Welding Techniques and Residual Stresses,290,JP,2025-11-25 22:06:42
2010,2210,Mechanical Engineering,T10204,Microstructure and mechanical properties,285,JP,2025-11-25 22:06:42
2010,2210,Mechanical Engineering,T11100,Intermetallics and Advanced Alloy Properties,282,JP,2025-11-25 22:06:42
2010,2210,Mechanical Engineering,T10850,Heat Transfer and Boiling Studies,279,JP,2025-11-25 22:06:42
2010,3107,"Atomic and Molecular Physics, and Optics",T10382,Quantum and electron transport phenomena,785,JP,2025-11-25 22:06:42
2010,3107,"Atomic and Molecular Physics, and Optics",T10049,Magnetic properties of thin films,763,JP,2025-11-25 22:06:42
2010,3107,"Atomic and Molecular Physics, and Optics",T10022,Semiconductor Quantum Structures and Devices,757,JP,2025-11-25 22:06:42
2010,3107,"Atomic and Molecular Physics, and Optics",T10923,Force Microscopy Techniques and Applications,680,JP,2025-11-25 22:06:42
2010,3107,"Atomic and Molecular Physics, and Optics",T10002,Advanced Chemical Physics Studies,651,JP,2025-11-25 22:06:42
2010,3107,"Atomic and Molecular Physics, and Optics",T10299,Photonic and Optical Devices,640,JP,2025-11-25 22:06:42
2010,3107,"Atomic and Molecular Physics, and Optics",T11177,Spectroscopy and Quantum Chemical Studies,572,JP,2025-11-25 22:06:42
2010,3107,"Atomic and Molecular Physics, and Optics",T10988,Advanced Fiber Laser Technologies,569,JP,2025-11-25 22:06:42
2010,3107,"Atomic and Molecular Physics, and Optics",T10037,Physics of Superconductivity and Magnetism,511,JP,2025-11-25 22:06:42
2010,3107,"Atomic and Molecular Physics, and Optics",T11449,Mechanical and Optical Resonators,477,JP,2025-11-25 22:06:42
2010,3107,"Atomic and Molecular Physics, and Optics",T11853,Semiconductor materials and interfaces,466,JP,2025-11-25 22:06:42
2010,3107,"Atomic and Molecular Physics, and Optics",T10666,Photonic Crystals and Applications,462,JP,2025-11-25 22:06:42
2010,3107,"Atomic and Molecular Physics, and Optics",T11993,Atomic and Subatomic Physics Research,390,JP,2025-11-25 22:06:42
2010,3107,"Atomic and Molecular Physics, and Optics",T10566,Laser-Matter Interactions and Applications,372,JP,2025-11-25 22:06:42
2010,3107,"Atomic and Molecular Physics, and Optics",T10523,Atomic and Molecular Physics,360,JP,2025-11-25 22:06:42
2010,3107,"Atomic and Molecular Physics, and Optics",T10472,Semiconductor materials and devices,335,JP,2025-11-25 22:06:42
2010,3107,"Atomic and Molecular Physics, and Optics",T11965,"Quantum, superfluid, helium dynamics",325,JP,2025-11-25 22:06:42
2010,3107,"Atomic and Molecular Physics, and Optics",T10425,Cold Atom Physics and Bose-Einstein Condensates,296,JP,2025-11-25 22:06:42
2010,3107,"Atomic and Molecular Physics, and Optics",T10913,Molecular Junctions and Nanostructures,284,JP,2025-11-25 22:06:42
2010,3107,"Atomic and Molecular Physics, and Optics",T10020,Quantum Information and Cryptography,276,JP,2025-11-25 22:06:42
2010,1605,Organic Chemistry,T10013,Asymmetric Synthesis and Catalysis,696,JP,2025-11-25 22:06:42
2010,1605,Organic Chemistry,T11549,Synthetic Organic Chemistry Methods,671,JP,2025-11-25 22:06:42
2010,1605,Organic Chemistry,T10354,Catalytic C–H Functionalization Methods,599,JP,2025-11-25 22:06:42
2010,1605,Organic Chemistry,T10835,Carbohydrate Chemistry and Synthesis,449,JP,2025-11-25 22:06:42
2010,1605,Organic Chemistry,T10548,Catalytic Cross-Coupling Reactions,435,JP,2025-11-25 22:06:42
2010,1605,Organic Chemistry,T11281,Asymmetric Hydrogenation and Catalysis,423,JP,2025-11-25 22:06:42
2010,1605,Organic Chemistry,T10911,Chemical Synthesis and Analysis,416,JP,2025-11-25 22:06:42
2010,1605,Organic Chemistry,T11989,Oxidative Organic Chemistry Reactions,376,JP,2025-11-25 22:06:42
2010,1605,Organic Chemistry,T10405,Advanced Polymer Synthesis and Characterization,351,JP,2025-11-25 22:06:42
2010,1605,Organic Chemistry,T10956,Fullerene Chemistry and Applications,349,JP,2025-11-25 22:06:42
2010,1605,Organic Chemistry,T11831,Chemical Synthesis and Reactions,342,JP,2025-11-25 22:06:42
2010,1605,Organic Chemistry,T11611,Cyclopropane Reaction Mechanisms,316,JP,2025-11-25 22:06:42
2010,1605,Organic Chemistry,T10871,Catalytic Alkyne Reactions,303,JP,2025-11-25 22:06:42
2010,1605,Organic Chemistry,T10092,Organometallic Complex Synthesis and Catalysis,293,JP,2025-11-25 22:06:42
2010,1605,Organic Chemistry,T12251,Synthesis and Catalytic Reactions,285,JP,2025-11-25 22:06:42
2010,1605,Organic Chemistry,T11298,Synthesis and Properties of Aromatic Compounds,280,JP,2025-11-25 22:06:42
2010,1605,Organic Chemistry,T10721,Surfactants and Colloidal Systems,264,JP,2025-11-25 22:06:42
2010,1605,Organic Chemistry,T11441,Organoboron and organosilicon chemistry,237,JP,2025-11-25 22:06:42
2010,1605,Organic Chemistry,T10578,Supramolecular Chemistry and Complexes,227,JP,2025-11-25 22:06:42
2010,1605,Organic Chemistry,T13124,Chemical synthesis and alkaloids,226,JP,2025-11-25 22:06:42
2010,1702,Artificial Intelligence,T10181,Natural Language Processing Techniques,484,JP,2025-11-25 22:06:42
2010,1702,Artificial Intelligence,T10320,Neural Networks and Applications,421,JP,2025-11-25 22:06:42
2010,1702,Artificial Intelligence,T10028,Topic Modeling,337,JP,2025-11-25 22:06:42
2010,1702,Artificial Intelligence,T10020,Quantum Information and Cryptography,335,JP,2025-11-25 22:06:42
2010,1702,Artificial Intelligence,T14335,Educational Robotics and Engineering,330,JP,2025-11-25 22:06:42
2010,1702,Artificial Intelligence,T10100,Metaheuristic Optimization Algorithms Research,310,JP,2025-11-25 22:06:42
2010,1702,Artificial Intelligence,T12031,Speech and dialogue systems,310,JP,2025-11-25 22:06:42
2010,1702,Artificial Intelligence,T10215,Semantic Web and Ontologies,293,JP,2025-11-25 22:06:42
2010,1702,Artificial Intelligence,T11975,Evolutionary Algorithms and Applications,282,JP,2025-11-25 22:06:42
2010,1702,Artificial Intelligence,T10201,Speech Recognition and Synthesis,265,JP,2025-11-25 22:06:42
2010,1702,Artificial Intelligence,T11269,Algorithms and Data Compression,236,JP,2025-11-25 22:06:42
2010,1702,Artificial Intelligence,T13083,Advanced Text Analysis Techniques,234,JP,2025-11-25 22:06:42
2010,1702,Artificial Intelligence,T11130,Coding theory and cryptography,231,JP,2025-11-25 22:06:42
2010,1702,Artificial Intelligence,T10237,Cryptography and Data Security,197,JP,2025-11-25 22:06:42
2010,1702,Artificial Intelligence,T10682,Quantum Computing Algorithms and Architecture,180,JP,2025-11-25 22:06:42
2010,1702,Artificial Intelligence,T10860,Speech and Audio Processing,171,JP,2025-11-25 22:06:42
2010,1702,Artificial Intelligence,T10462,Reinforcement Learning in Robotics,165,JP,2025-11-25 22:06:42
2010,1702,Artificial Intelligence,T11598,Internet Traffic Analysis and Secure E-voting,156,JP,2025-11-25 22:06:42
2010,1702,Artificial Intelligence,T12157,Geochemistry and Geologic Mapping,148,JP,2025-11-25 22:06:42
2010,1702,Artificial Intelligence,T10126,"Logic, programming, and type systems",142,JP,2025-11-25 22:06:42
2010,1312,Molecular Biology,T10911,Chemical Synthesis and Analysis,505,JP,2025-11-25 22:06:42
2010,1312,Molecular Biology,T10207,Advanced biosensing and bioanalysis techniques,430,JP,2025-11-25 22:06:42
2010,1312,Molecular Biology,T11162,Enzyme Structure and Function,339,JP,2025-11-25 22:06:42
2010,1312,Molecular Biology,T10044,Protein Structure and Dynamics,337,JP,2025-11-25 22:06:42
2010,1312,Molecular Biology,T10835,Carbohydrate Chemistry and Synthesis,288,JP,2025-11-25 22:06:42
2010,1312,Molecular Biology,T10303,Photosynthetic Processes and Mechanisms,275,JP,2025-11-25 22:06:42
2010,1312,Molecular Biology,T10602,Glycosylation and Glycoproteins Research,268,JP,2025-11-25 22:06:42
2010,1312,Molecular Biology,T11786,Geomagnetism and Paleomagnetism Studies,248,JP,2025-11-25 22:06:42
2010,1312,Molecular Biology,T10407,Lipid Membrane Structure and Behavior,230,JP,2025-11-25 22:06:42
2010,1312,Molecular Biology,T10015,Genomics and Phylogenetic Studies,229,JP,2025-11-25 22:06:42
2010,1312,Molecular Biology,T10932,Microbial Metabolic Engineering and Bioproduction,213,JP,2025-11-25 22:06:42
2010,1312,Molecular Biology,T11791,Microbial Community Ecology and Physiology,212,JP,2025-11-25 22:06:42
2010,1312,Molecular Biology,T10171,Biofuel production and bioconversion,184,JP,2025-11-25 22:06:42
2010,1312,Molecular Biology,T11048,Bacteriophages and microbial interactions,180,JP,2025-11-25 22:06:42
2010,1312,Molecular Biology,T10404,Enzyme Catalysis and Immobilization,165,JP,2025-11-25 22:06:42
2010,1312,Molecular Biology,T11879,Protist diversity and phylogeny,159,JP,2025-11-25 22:06:42
2010,1312,Molecular Biology,T10432,DNA and Nucleic Acid Chemistry,157,JP,2025-11-25 22:06:42
2010,1312,Molecular Biology,T10211,Computational Drug Discovery Methods,153,JP,2025-11-25 22:06:42
2010,1312,Molecular Biology,T10521,RNA and protein synthesis mechanisms,139,JP,2025-11-25 22:06:42
2010,1312,Molecular Biology,T12029,DNA and Biological Computing,133,JP,2025-11-25 22:06:42
2010,2211,Mechanics of Materials,T10377,Metal and Thin Film Mechanics,968,JP,2025-11-25 22:06:42
2010,2211,Mechanics of Materials,T11201,Metallurgy and Material Forming,613,JP,2025-11-25 22:06:42
2010,2211,Mechanics of Materials,T10396,Fatigue and fracture mechanics,534,JP,2025-11-25 22:06:42
2010,2211,Mechanics of Materials,T11799,"Adhesion, Friction, and Surface Interactions",409,JP,2025-11-25 22:06:42
2010,2211,Mechanics of Materials,T10662,Ultrasonics and Acoustic Wave Propagation,354,JP,2025-11-25 22:06:42
2010,2211,Mechanics of Materials,T11854,Laser-induced spectroscopy and plasma,345,JP,2025-11-25 22:06:42
2010,2211,Mechanics of Materials,T10478,Diamond and Carbon-based Materials Research,295,JP,2025-11-25 22:06:42
2010,2211,Mechanics of Materials,T10700,Metal Forming Simulation Techniques,280,JP,2025-11-25 22:06:42
2010,2211,Mechanics of Materials,T12252,Mechanical stress and fatigue analysis,260,JP,2025-11-25 22:06:42
2010,2211,Mechanics of Materials,T10219,Mechanical Behavior of Composites,244,JP,2025-11-25 22:06:42
2010,2211,Mechanics of Materials,T12362,Tribology and Wear Analysis,241,JP,2025-11-25 22:06:42
2010,2211,Mechanics of Materials,T10386,Microstructure and Mechanical Properties of Steels,200,JP,2025-11-25 22:06:42
2010,2211,Mechanics of Materials,T10514,Numerical methods in engineering,176,JP,2025-11-25 22:06:42
2010,2211,Mechanics of Materials,T12537,Flow Measurement and Analysis,167,JP,2025-11-25 22:06:42
2010,2211,Mechanics of Materials,T12169,Non-Destructive Testing Techniques,161,JP,2025-11-25 22:06:42
2010,2211,Mechanics of Materials,T12579,Muon and positron interactions and applications,161,JP,2025-11-25 22:06:42
2010,2211,Mechanics of Materials,T10399,Hydrocarbon exploration and reservoir analysis,159,JP,2025-11-25 22:06:42
2010,2211,Mechanics of Materials,T12427,Metal Alloys Wear and Properties,159,JP,2025-11-25 22:06:42
2010,2211,Mechanics of Materials,T10472,Semiconductor materials and devices,137,JP,2025-11-25 22:06:42
2010,2211,Mechanics of Materials,T12971,Material Properties and Processing,137,JP,2025-11-25 22:06:42
2010,2202,Aerospace Engineering,T10191,Robotics and Sensor-Based Localization,516,JP,2025-11-25 22:06:42
2010,2202,Aerospace Engineering,T11367,Particle accelerators and beam dynamics,482,JP,2025-11-25 22:06:42
2010,2202,Aerospace Engineering,T10597,Nuclear reactor physics and engineering,459,JP,2025-11-25 22:06:42
2010,2202,Aerospace Engineering,T10670,Aluminum Alloy Microstructure Properties,439,JP,2025-11-25 22:06:42
2010,2202,Aerospace Engineering,T10069,Antenna Design and Analysis,365,JP,2025-11-25 22:06:42
