year,subfield_id,subfield_name,id,name,works_count,country,fetch_date
2014,1605,Organic Chemistry,T10548,Catalytic Cross-Coupling Reactions,469,JP,2025-11-25 22:06:42
2014,1605,Organic Chemistry,T11281,Asymmetric Hydrogenation and Catalysis,444,JP,2025-11-25 22:06:42
2014,1605,Organic Chemistry,T11989,Oxidative Organic Chemistry Reactions,418,JP,2025-11-25 22:06:42
2014,1605,Organic Chemistry,T10911,Chemical Synthesis and Analysis,417,JP,2025-11-25 22:06:42
2014,1605,Organic Chemistry,T10405,Advanced Polymer Synthesis and Characterization,354,JP,2025-11-25 22:06:42
2014,1605,Organic Chemistry,T11831,Chemical Synthesis and Reactions,339,JP,2025-11-25 22:06:42
2014,1605,Organic Chemistry,T11298,Synthesis and Properties of Aromatic Compounds,330,JP,2025-11-25 22:06:42
2014,1605,Organic Chemistry,T12251,Synthesis and Catalytic Reactions,329,JP,2025-11-25 22:06:42
2014,1605,Organic Chemistry,T10956,Fullerene Chemistry and Applications,301,JP,2025-11-25 22:06:42
2014,1605,Organic Chemistry,T10092,Organometallic Complex Synthesis and Catalysis,287,JP,2025-11-25 22:06:42
2014,1605,Organic Chemistry,T11611,Cyclopropane Reaction Mechanisms,284,JP,2025-11-25 22:06:42
2014,1605,Organic Chemistry,T12240,Nanomaterials for catalytic reactions,275,JP,2025-11-25 22:06:42
2014,1605,Organic Chemistry,T10602,Glycosylation and Glycoproteins Research,268,JP,2025-11-25 22:06:42
2014,1605,Organic Chemistry,T10578,Supramolecular Chemistry and Complexes,265,JP,2025-11-25 22:06:42
2014,1605,Organic Chemistry,T10721,Surfactants and Colloidal Systems,263,JP,2025-11-25 22:06:42
2014,1605,Organic Chemistry,T10871,Catalytic Alkyne Reactions,248,JP,2025-11-25 22:06:42
2014,1702,Artificial Intelligence,T10181,Natural Language Processing Techniques,476,JP,2025-11-25 22:06:42
2014,1702,Artificial Intelligence,T10020,Quantum Information and Cryptography,399,JP,2025-11-25 22:06:42
2014,1702,Artificial Intelligence,T10320,Neural Networks and Applications,366,JP,2025-11-25 22:06:42
2014,1702,Artificial Intelligence,T10028,Topic Modeling,343,JP,2025-11-25 22:06:42
2014,1702,Artificial Intelligence,T13018,Seismology and Earthquake Studies,339,JP,2025-11-25 22:06:42
2014,1702,Artificial Intelligence,T14335,Educational Robotics and Engineering,298,JP,2025-11-25 22:06:42
2014,1702,Artificial Intelligence,T10215,Semantic Web and Ontologies,275,JP,2025-11-25 22:06:42
2014,1702,Artificial Intelligence,T12157,Geochemistry and Geologic Mapping,261,JP,2025-11-25 22:06:42
2014,1702,Artificial Intelligence,T10110,earthquake and tectonic studies,258,JP,2025-11-25 22:06:42
2014,1702,Artificial Intelligence,T10237,Cryptography and Data Security,252,JP,2025-11-25 22:06:42
2014,1702,Artificial Intelligence,T11269,Algorithms and Data Compression,239,JP,2025-11-25 22:06:42
2014,1702,Artificial Intelligence,T10201,Speech Recognition and Synthesis,238,JP,2025-11-25 22:06:42
2014,1702,Artificial Intelligence,T12031,Speech and dialogue systems,238,JP,2025-11-25 22:06:42
2014,1702,Artificial Intelligence,T10682,Quantum Computing Algorithms and Architecture,234,JP,2025-11-25 22:06:42
2014,1702,Artificial Intelligence,T13083,Advanced Text Analysis Techniques,222,JP,2025-11-25 22:06:42
2014,1702,Artificial Intelligence,T10100,Metaheuristic Optimization Algorithms Research,200,JP,2025-11-25 22:06:42
2014,1702,Artificial Intelligence,T11130,Coding theory and cryptography,189,JP,2025-11-25 22:06:42
2014,1702,Artificial Intelligence,T10001,Geological and Geochemical Analysis,173,JP,2025-11-25 22:06:42
2014,1702,Artificial Intelligence,T10951,Cryptographic Implementations and Security,170,JP,2025-11-25 22:06:42
2014,1702,Artificial Intelligence,T11975,Evolutionary Algorithms and Applications,161,JP,2025-11-25 22:06:42
2014,1312,Molecular Biology,T10207,Advanced biosensing and bioanalysis techniques,503,JP,2025-11-25 22:06:42
2014,1312,Molecular Biology,T10911,Chemical Synthesis and Analysis,493,JP,2025-11-25 22:06:42
2014,1312,Molecular Biology,T11786,Geomagnetism and Paleomagnetism Studies,368,JP,2025-11-25 22:06:42
2014,1312,Molecular Biology,T10835,Carbohydrate Chemistry and Synthesis,367,JP,2025-11-25 22:06:42
2014,1312,Molecular Biology,T10602,Glycosylation and Glycoproteins Research,354,JP,2025-11-25 22:06:42
2014,1312,Molecular Biology,T11162,Enzyme Structure and Function,333,JP,2025-11-25 22:06:42
2014,1312,Molecular Biology,T10303,Photosynthetic Processes and Mechanisms,316,JP,2025-11-25 22:06:42
2014,1312,Molecular Biology,T10044,Protein Structure and Dynamics,279,JP,2025-11-25 22:06:42
2014,1312,Molecular Biology,T11791,Microbial Community Ecology and Physiology,274,JP,2025-11-25 22:06:42
2014,1312,Molecular Biology,T10015,Genomics and Phylogenetic Studies,273,JP,2025-11-25 22:06:42
2014,1312,Molecular Biology,T10932,Microbial Metabolic Engineering and Bioproduction,258,JP,2025-11-25 22:06:42
2014,1312,Molecular Biology,T10171,Biofuel production and bioconversion,233,JP,2025-11-25 22:06:42
2014,1312,Molecular Biology,T10407,Lipid Membrane Structure and Behavior,232,JP,2025-11-25 22:06:42
2014,1312,Molecular Biology,T11048,Bacteriophages and microbial interactions,208,JP,2025-11-25 22:06:42
2014,1312,Molecular Biology,T11879,Protist diversity and phylogeny,185,JP,2025-11-25 22:06:42
2014,1312,Molecular Biology,T10404,Enzyme Catalysis and Immobilization,176,JP,2025-11-25 22:06:42
2014,1312,Molecular Biology,T10836,Metabolomics and Mass Spectrometry Studies,176,JP,2025-11-25 22:06:42
2014,1312,Molecular Biology,T10725,RNA Interference and Gene Delivery,175,JP,2025-11-25 22:06:42
2014,1312,Molecular Biology,T10432,DNA and Nucleic Acid Chemistry,150,JP,2025-11-25 22:06:42
2014,1312,Molecular Biology,T10476,Algal biology and biofuel production,150,JP,2025-11-25 22:06:42
2014,2202,Aerospace Engineering,T10597,Nuclear reactor physics and engineering,537,JP,2025-11-25 22:06:42
2014,2202,Aerospace Engineering,T10191,Robotics and Sensor-Based Localization,535,JP,2025-11-25 22:06:42
2014,2202,Aerospace Engineering,T10069,Antenna Design and Analysis,463,JP,2025-11-25 22:06:42
2014,2202,Aerospace Engineering,T10670,Aluminum Alloy Microstructure Properties,395,JP,2025-11-25 22:06:42
2014,2202,Aerospace Engineering,T11367,Particle accelerators and beam dynamics,335,JP,2025-11-25 22:06:42
2014,2202,Aerospace Engineering,T11242,Nuclear Materials and Properties,296,JP,2025-11-25 22:06:42
2014,2202,Aerospace Engineering,T13200,Spacecraft and Cryogenic Technologies,292,JP,2025-11-25 22:06:42
2014,2202,Aerospace Engineering,T11383,Advanced Antenna and Metasurface Technologies,269,JP,2025-11-25 22:06:42
2014,2202,Aerospace Engineering,T12081,Aerodynamics and Fluid Dynamics Research,265,JP,2025-11-25 22:06:42
2014,2202,Aerospace Engineering,T10262,Microwave Engineering and Waveguides,232,JP,2025-11-25 22:06:42
2014,2202,Aerospace Engineering,T10360,Fluid Dynamics and Turbulent Flows,223,JP,2025-11-25 22:06:42
2014,2202,Aerospace Engineering,T11949,Nuclear Physics and Applications,220,JP,2025-11-25 22:06:42
2014,2202,Aerospace Engineering,T11619,Combustion and Detonation Processes,219,JP,2025-11-25 22:06:42
2014,2202,Aerospace Engineering,T10717,Aluminum Alloys Composites Properties,206,JP,2025-11-25 22:06:42
2014,2202,Aerospace Engineering,T10626,High-Temperature Coating Behaviors,188,JP,2025-11-25 22:06:42
2014,2202,Aerospace Engineering,T11008,Aerodynamics and Acoustics in Jet Flows,185,JP,2025-11-25 22:06:42
2014,2202,Aerospace Engineering,T12560,Nuclear Engineering Thermal-Hydraulics,185,JP,2025-11-25 22:06:42
2014,2202,Aerospace Engineering,T12007,Plasma and Flow Control in Aerodynamics,166,JP,2025-11-25 22:06:42
2014,2202,Aerospace Engineering,T10586,Robotic Path Planning Algorithms,158,JP,2025-11-25 22:06:42
2014,2202,Aerospace Engineering,T11946,Antenna Design and Optimization,156,JP,2025-11-25 22:06:42
2014,2211,Mechanics of Materials,T10377,Metal and Thin Film Mechanics,751,JP,2025-11-25 22:06:42
2014,2211,Mechanics of Materials,T11201,Metallurgy and Material Forming,673,JP,2025-11-25 22:06:42
2014,2211,Mechanics of Materials,T10396,Fatigue and fracture mechanics,515,JP,2025-11-25 22:06:42
2014,2211,Mechanics of Materials,T11799,"Adhesion, Friction, and Surface Interactions",371,JP,2025-11-25 22:06:42
2014,2211,Mechanics of Materials,T10700,Metal Forming Simulation Techniques,364,JP,2025-11-25 22:06:42
2014,2211,Mechanics of Materials,T10662,Ultrasonics and Acoustic Wave Propagation,339,JP,2025-11-25 22:06:42
2014,2211,Mechanics of Materials,T11854,Laser-induced spectroscopy and plasma,314,JP,2025-11-25 22:06:42
2014,2211,Mechanics of Materials,T10219,Mechanical Behavior of Composites,286,JP,2025-11-25 22:06:42
2014,2211,Mechanics of Materials,T10399,Hydrocarbon exploration and reservoir analysis,255,JP,2025-11-25 22:06:42
2014,2211,Mechanics of Materials,T10478,Diamond and Carbon-based Materials Research,246,JP,2025-11-25 22:06:42
2014,2211,Mechanics of Materials,T10386,Microstructure and Mechanical Properties of Steels,227,JP,2025-11-25 22:06:42
2014,2211,Mechanics of Materials,T12252,Mechanical stress and fatigue analysis,216,JP,2025-11-25 22:06:42
2014,2211,Mechanics of Materials,T12579,Muon and positron interactions and applications,198,JP,2025-11-25 22:06:42
2014,2211,Mechanics of Materials,T12362,Tribology and Wear Analysis,188,JP,2025-11-25 22:06:42
2014,2211,Mechanics of Materials,T10161,Rock Mechanics and Modeling,169,JP,2025-11-25 22:06:42
2014,2211,Mechanics of Materials,T10514,Numerical methods in engineering,169,JP,2025-11-25 22:06:42
2014,2211,Mechanics of Materials,T12169,Non-Destructive Testing Techniques,167,JP,2025-11-25 22:06:42
2014,2211,Mechanics of Materials,T12537,Flow Measurement and Analysis,151,JP,2025-11-25 22:06:42
2014,2211,Mechanics of Materials,T10204,Microstructure and mechanical properties,141,JP,2025-11-25 22:06:42
2014,2211,Mechanics of Materials,T12971,Material Properties and Processing,136,JP,2025-11-25 22:06:42
2015,2208,Electrical and Electronic Engineering,T10472,Semiconductor materials and devices,1369,JP,2025-11-25 22:06:42
2015,2208,Electrical and Electronic Engineering,T10299,Photonic and Optical Devices,1364,JP,2025-11-25 22:06:42
2015,2208,Electrical and Electronic Engineering,T10232,Optical Network Technologies,858,JP,2025-11-25 22:06:42
2015,2208,Electrical and Electronic Engineering,T10018,Advancements in Battery Materials,786,JP,2025-11-25 22:06:42
2015,2208,Electrical and Electronic Engineering,T10409,Fuel Cells and Related Materials,686,JP,2025-11-25 22:06:42
2015,2208,Electrical and Electronic Engineering,T10660,Conducting polymers and applications,669,JP,2025-11-25 22:06:42
2015,2208,Electrical and Electronic Engineering,T10045,Organic Electronics and Photovoltaics,656,JP,2025-11-25 22:06:42
2015,2208,Electrical and Electronic Engineering,T10767,Advanced Photonic Communication Systems,651,JP,2025-11-25 22:06:42
2015,2208,Electrical and Electronic Engineering,T10913,Molecular Junctions and Nanostructures,603,JP,2025-11-25 22:06:42
2015,2208,Electrical and Electronic Engineering,T10623,Thin-Film Transistor Technologies,589,JP,2025-11-25 22:06:42
2015,2208,Electrical and Electronic Engineering,T11429,Semiconductor Lasers and Optical Devices,587,JP,2025-11-25 22:06:42
2015,2208,Electrical and Electronic Engineering,T10281,Advanced Battery Materials and Technologies,572,JP,2025-11-25 22:06:42
2015,2208,Electrical and Electronic Engineering,T10590,Chalcogenide Semiconductor Thin Films,500,JP,2025-11-25 22:06:42
2015,2208,Electrical and Electronic Engineering,T10558,Advancements in Semiconductor Devices and Circuit Design,498,JP,2025-11-25 22:06:42
2015,2208,Electrical and Electronic Engineering,T11392,Energy Harvesting in Wireless Networks,498,JP,2025-11-25 22:06:42
2015,2208,Electrical and Electronic Engineering,T10461,Gas Sensing Nanomaterials and Sensors,470,JP,2025-11-25 22:06:42
2015,2208,Electrical and Electronic Engineering,T10030,Electrocatalysts for Energy Conversion,469,JP,2025-11-25 22:06:42
2015,2208,Electrical and Electronic Engineering,T10502,Advanced Memory and Neural Computing,469,JP,2025-11-25 22:06:42
2015,2208,Electrical and Electronic Engineering,T10361,Silicon Carbide Semiconductor Technologies,467,JP,2025-11-25 22:06:42
2015,2208,Electrical and Electronic Engineering,T14117,Integrated Circuits and Semiconductor Failure Analysis,449,JP,2025-11-25 22:06:42
2015,2505,Materials Chemistry,T10083,Graphene research and applications,952,JP,2025-11-25 22:06:42
2015,2505,Materials Chemistry,T10192,Catalytic Processes in Materials Science,857,JP,2025-11-25 22:06:42
2015,2505,Materials Chemistry,T10090,ZnO doping and properties,710,JP,2025-11-25 22:06:42
2015,2505,Materials Chemistry,T10478,Diamond and Carbon-based Materials Research,607,JP,2025-11-25 22:06:42
2015,2505,Materials Chemistry,T10903,Porphyrin and Phthalocyanine Chemistry,592,JP,2025-11-25 22:06:42
2015,2505,Materials Chemistry,T11242,Nuclear Materials and Properties,577,JP,2025-11-25 22:06:42
2015,2505,Materials Chemistry,T10321,Quantum Dots Synthesis And Properties,565,JP,2025-11-25 22:06:42
2015,2505,Materials Chemistry,T11240,Luminescence and Fluorescent Materials,533,JP,2025-11-25 22:06:42
2015,2505,Materials Chemistry,T12588,Electronic and Structural Properties of Oxides,529,JP,2025-11-25 22:06:42
2015,2505,Materials Chemistry,T10078,Advanced Photocatalysis Techniques,493,JP,2025-11-25 22:06:42
2015,2505,Materials Chemistry,T10074,Carbon Nanotubes in Composites,492,JP,2025-11-25 22:06:42
2015,2505,Materials Chemistry,T10311,Advancements in Solid Oxide Fuel Cells,444,JP,2025-11-25 22:06:42
2015,2505,Materials Chemistry,T10107,Ferroelectric and Piezoelectric Materials,439,JP,2025-11-25 22:06:42
2015,2505,Materials Chemistry,T10377,Metal and Thin Film Mechanics,413,JP,2025-11-25 22:06:42
2015,2505,Materials Chemistry,T10592,Fusion materials and technologies,391,JP,2025-11-25 22:06:42
2015,2505,Materials Chemistry,T10472,Semiconductor materials and devices,386,JP,2025-11-25 22:06:42
2015,2505,Materials Chemistry,T10097,Luminescence Properties of Advanced Materials,376,JP,2025-11-25 22:06:42
2015,2505,Materials Chemistry,T11907,Copper-based nanomaterials and applications,373,JP,2025-11-25 22:06:42
2015,2505,Materials Chemistry,T10590,Chalcogenide Semiconductor Thin Films,370,JP,2025-11-25 22:06:42
2015,2505,Materials Chemistry,T10204,Microstructure and mechanical properties,365,JP,2025-11-25 22:06:42
2015,2204,Biomedical Engineering,T10338,Advanced Sensor and Energy Harvesting Materials,693,JP,2025-11-25 22:06:42
2015,2204,Biomedical Engineering,T10784,Muscle activation and electromyography studies,690,JP,2025-11-25 22:06:42
2015,2204,Biomedical Engineering,T11301,Advanced Surface Polishing Techniques,612,JP,2025-11-25 22:06:42
2015,2204,Biomedical Engineering,T10879,Robotic Locomotion and Control,529,JP,2025-11-25 22:06:42
2015,2204,Biomedical Engineering,T11190,3D Printing in Biomedical Research,501,JP,2025-11-25 22:06:42
2015,2204,Biomedical Engineering,T10412,Microfluidic and Capillary Electrophoresis Applications,470,JP,2025-11-25 22:06:42
2015,2204,Biomedical Engineering,T11667,Advanced Chemical Sensor Technologies,461,JP,2025-11-25 22:06:42
2015,2204,Biomedical Engineering,T10059,Bone Tissue Engineering Materials,459,JP,2025-11-25 22:06:42
2015,2204,Biomedical Engineering,T11255,Microfluidic and Bio-sensing Technologies,449,JP,2025-11-25 22:06:42
2015,2204,Biomedical Engineering,T10868,Soft Robotics and Applications,440,JP,2025-11-25 22:06:42
2015,2204,Biomedical Engineering,T11407,Innovative Microfluidic and Catalytic Techniques Innovation,424,JP,2025-11-25 22:06:42
2015,2204,Biomedical Engineering,T10171,Biofuel production and bioconversion,403,JP,2025-11-25 22:06:42
2015,2204,Biomedical Engineering,T11160,Acoustic Wave Resonator Technologies,401,JP,2025-11-25 22:06:42
2015,2204,Biomedical Engineering,T11808,Superconducting Materials and Applications,394,JP,2025-11-25 22:06:42
2015,2204,Biomedical Engineering,T11023,Prosthetics and Rehabilitation Robotics,383,JP,2025-11-25 22:06:42
2015,2204,Biomedical Engineering,T11272,Nanowire Synthesis and Applications,383,JP,2025-11-25 22:06:42
2015,2204,Biomedical Engineering,T12224,Nanofabrication and Lithography Techniques,369,JP,2025-11-25 22:06:42
2015,2204,Biomedical Engineering,T10675,Mechanical Circulatory Support Devices,344,JP,2025-11-25 22:06:42
2015,2204,Biomedical Engineering,T12386,Advanced X-ray and CT Imaging,326,JP,2025-11-25 22:06:42
2015,2204,Biomedical Engineering,T12015,Photoacoustic and Ultrasonic Imaging,320,JP,2025-11-25 22:06:42
2015,2210,Mechanical Engineering,T12784,Modular Robots and Swarm Intelligence,568,JP,2025-11-25 22:06:42
2015,2210,Mechanical Engineering,T10717,Aluminum Alloys Composites Properties,534,JP,2025-11-25 22:06:42
2015,2210,Mechanical Engineering,T10386,Microstructure and Mechanical Properties of Steels,490,JP,2025-11-25 22:06:42
2015,2210,Mechanical Engineering,T11201,Metallurgy and Material Forming,457,JP,2025-11-25 22:06:42
2015,2210,Mechanical Engineering,T11687,Teleoperation and Haptic Systems,425,JP,2025-11-25 22:06:42
2015,2210,Mechanical Engineering,T10700,Metal Forming Simulation Techniques,407,JP,2025-11-25 22:06:42
2015,2210,Mechanical Engineering,T12169,Non-Destructive Testing Techniques,354,JP,2025-11-25 22:06:42
2015,2210,Mechanical Engineering,T12099,Advanced materials and composites,329,JP,2025-11-25 22:06:42
2015,2210,Mechanical Engineering,T10188,Advanced machining processes and optimization,316,JP,2025-11-25 22:06:42
2015,2210,Mechanical Engineering,T11091,Extraction and Separation Processes,303,JP,2025-11-25 22:06:42
2015,2210,Mechanical Engineering,T10396,Fatigue and fracture mechanics,299,JP,2025-11-25 22:06:42
2015,2210,Mechanical Engineering,T10723,Advanced Welding Techniques Analysis,291,JP,2025-11-25 22:06:42
2015,2210,Mechanical Engineering,T10834,Welding Techniques and Residual Stresses,288,JP,2025-11-25 22:06:42
2015,2210,Mechanical Engineering,T11301,Advanced Surface Polishing Techniques,278,JP,2025-11-25 22:06:42
2015,2210,Mechanical Engineering,T10670,Aluminum Alloy Microstructure Properties,276,JP,2025-11-25 22:06:42
2015,2210,Mechanical Engineering,T11372,Hydraulic and Pneumatic Systems,273,JP,2025-11-25 22:06:42
2015,2210,Mechanical Engineering,T11737,Advanced Materials and Mechanics,260,JP,2025-11-25 22:06:42
2015,2210,Mechanical Engineering,T10998,Heat Transfer and Optimization,257,JP,2025-11-25 22:06:42
2015,2210,Mechanical Engineering,T10850,Heat Transfer and Boiling Studies,253,JP,2025-11-25 22:06:42
2015,2210,Mechanical Engineering,T12427,Metal Alloys Wear and Properties,239,JP,2025-11-25 22:06:42
2015,3107,"Atomic and Molecular Physics, and Optics",T10049,Magnetic properties of thin films,876,JP,2025-11-25 22:06:42
2015,3107,"Atomic and Molecular Physics, and Optics",T10382,Quantum and electron transport phenomena,753,JP,2025-11-25 22:06:42
2015,3107,"Atomic and Molecular Physics, and Optics",T10299,Photonic and Optical Devices,613,JP,2025-11-25 22:06:42
2015,3107,"Atomic and Molecular Physics, and Optics",T11177,Spectroscopy and Quantum Chemical Studies,570,JP,2025-11-25 22:06:42
2015,3107,"Atomic and Molecular Physics, and Optics",T10002,Advanced Chemical Physics Studies,566,JP,2025-11-25 22:06:42
2015,3107,"Atomic and Molecular Physics, and Optics",T10988,Advanced Fiber Laser Technologies,566,JP,2025-11-25 22:06:42
2015,3107,"Atomic and Molecular Physics, and Optics",T10022,Semiconductor Quantum Structures and Devices,526,JP,2025-11-25 22:06:42
2015,3107,"Atomic and Molecular Physics, and Optics",T10923,Force Microscopy Techniques and Applications,511,JP,2025-11-25 22:06:42
2015,3107,"Atomic and Molecular Physics, and Optics",T11853,Semiconductor materials and interfaces,459,JP,2025-11-25 22:06:42
2015,3107,"Atomic and Molecular Physics, and Optics",T10037,Physics of Superconductivity and Magnetism,457,JP,2025-11-25 22:06:42
2015,3107,"Atomic and Molecular Physics, and Optics",T10666,Photonic Crystals and Applications,405,JP,2025-11-25 22:06:42
2015,3107,"Atomic and Molecular Physics, and Optics",T11993,Atomic and Subatomic Physics Research,378,JP,2025-11-25 22:06:42
2015,3107,"Atomic and Molecular Physics, and Optics",T11449,Mechanical and Optical Resonators,374,JP,2025-11-25 22:06:42
2015,3107,"Atomic and Molecular Physics, and Optics",T10523,Atomic and Molecular Physics,369,JP,2025-11-25 22:06:42
2015,3107,"Atomic and Molecular Physics, and Optics",T10657,Topological Materials and Phenomena,350,JP,2025-11-25 22:06:42
2015,3107,"Atomic and Molecular Physics, and Optics",T10566,Laser-Matter Interactions and Applications,307,JP,2025-11-25 22:06:42
2015,3107,"Atomic and Molecular Physics, and Optics",T10083,Graphene research and applications,291,JP,2025-11-25 22:06:42
2015,3107,"Atomic and Molecular Physics, and Optics",T10425,Cold Atom Physics and Bose-Einstein Condensates,281,JP,2025-11-25 22:06:42
2015,3107,"Atomic and Molecular Physics, and Optics",T10020,Quantum Information and Cryptography,275,JP,2025-11-25 22:06:42
2015,3107,"Atomic and Molecular Physics, and Optics",T11222,Magnetic Properties and Applications,260,JP,2025-11-25 22:06:42
2015,1605,Organic Chemistry,T10354,Catalytic C–H Functionalization Methods,812,JP,2025-11-25 22:06:42
2015,1605,Organic Chemistry,T11549,Synthetic Organic Chemistry Methods,655,JP,2025-11-25 22:06:42
2015,1605,Organic Chemistry,T10013,Asymmetric Synthesis and Catalysis,569,JP,2025-11-25 22:06:42
2015,1605,Organic Chemistry,T10548,Catalytic Cross-Coupling Reactions,490,JP,2025-11-25 22:06:42
2015,1605,Organic Chemistry,T11281,Asymmetric Hydrogenation and Catalysis,472,JP,2025-11-25 22:06:42
2015,1605,Organic Chemistry,T10911,Chemical Synthesis and Analysis,445,JP,2025-11-25 22:06:42
2015,1605,Organic Chemistry,T10405,Advanced Polymer Synthesis and Characterization,386,JP,2025-11-25 22:06:42
2015,1605,Organic Chemistry,T11298,Synthesis and Properties of Aromatic Compounds,376,JP,2025-11-25 22:06:42
2015,1605,Organic Chemistry,T10835,Carbohydrate Chemistry and Synthesis,373,JP,2025-11-25 22:06:42
2015,1605,Organic Chemistry,T11989,Oxidative Organic Chemistry Reactions,353,JP,2025-11-25 22:06:42
2015,1605,Organic Chemistry,T11831,Chemical Synthesis and Reactions,325,JP,2025-11-25 22:06:42
2015,1605,Organic Chemistry,T12251,Synthesis and Catalytic Reactions,322,JP,2025-11-25 22:06:42
2015,1605,Organic Chemistry,T11611,Cyclopropane Reaction Mechanisms,314,JP,2025-11-25 22:06:42
2015,1605,Organic Chemistry,T10956,Fullerene Chemistry and Applications,290,JP,2025-11-25 22:06:42
2015,1605,Organic Chemistry,T11441,Organoboron and organosilicon chemistry,284,JP,2025-11-25 22:06:42
2015,1605,Organic Chemistry,T12240,Nanomaterials for catalytic reactions,274,JP,2025-11-25 22:06:42
2015,1605,Organic Chemistry,T10092,Organometallic Complex Synthesis and Catalysis,262,JP,2025-11-25 22:06:42
2015,1605,Organic Chemistry,T10871,Catalytic Alkyne Reactions,251,JP,2025-11-25 22:06:42
2015,1605,Organic Chemistry,T12189,Sulfur-Based Synthesis Techniques,246,JP,2025-11-25 22:06:42
2015,1605,Organic Chemistry,T10947,Fluorine in Organic Chemistry,232,JP,2025-11-25 22:06:42
2015,1702,Artificial Intelligence,T10181,Natural Language Processing Techniques,477,JP,2025-11-25 22:06:42
2015,1702,Artificial Intelligence,T14335,Educational Robotics and Engineering,354,JP,2025-11-25 22:06:42
2015,1702,Artificial Intelligence,T10028,Topic Modeling,343,JP,2025-11-25 22:06:42
2015,1702,Artificial Intelligence,T10020,Quantum Information and Cryptography,338,JP,2025-11-25 22:06:42
2015,1702,Artificial Intelligence,T13018,Seismology and Earthquake Studies,328,JP,2025-11-25 22:06:42
2015,1702,Artificial Intelligence,T10237,Cryptography and Data Security,297,JP,2025-11-25 22:06:42
2015,1702,Artificial Intelligence,T10320,Neural Networks and Applications,293,JP,2025-11-25 22:06:42
2015,1702,Artificial Intelligence,T12157,Geochemistry and Geologic Mapping,250,JP,2025-11-25 22:06:42
2015,1702,Artificial Intelligence,T13083,Advanced Text Analysis Techniques,242,JP,2025-11-25 22:06:42
2015,1702,Artificial Intelligence,T12031,Speech and dialogue systems,239,JP,2025-11-25 22:06:42
2015,1702,Artificial Intelligence,T10215,Semantic Web and Ontologies,233,JP,2025-11-25 22:06:42
2015,1702,Artificial Intelligence,T10110,earthquake and tectonic studies,230,JP,2025-11-25 22:06:42
2015,1702,Artificial Intelligence,T10201,Speech Recognition and Synthesis,229,JP,2025-11-25 22:06:42
2015,1702,Artificial Intelligence,T10682,Quantum Computing Algorithms and Architecture,208,JP,2025-11-25 22:06:42
2015,1702,Artificial Intelligence,T11130,Coding theory and cryptography,205,JP,2025-11-25 22:06:42
2015,1702,Artificial Intelligence,T10100,Metaheuristic Optimization Algorithms Research,197,JP,2025-11-25 22:06:42
2015,1702,Artificial Intelligence,T11269,Algorithms and Data Compression,196,JP,2025-11-25 22:06:42
2015,1702,Artificial Intelligence,T11975,Evolutionary Algorithms and Applications,178,JP,2025-11-25 22:06:42
2015,1702,Artificial Intelligence,T10951,Cryptographic Implementations and Security,170,JP,2025-11-25 22:06:42
2015,1702,Artificial Intelligence,T10001,Geological and Geochemical Analysis,159,JP,2025-11-25 22:06:42
2015,2202,Aerospace Engineering,T10191,Robotics and Sensor-Based Localization,571,JP,2025-11-25 22:06:42
2015,2202,Aerospace Engineering,T10069,Antenna Design and Analysis,441,JP,2025-11-25 22:06:42
2015,2202,Aerospace Engineering,T11367,Particle accelerators and beam dynamics,425,JP,2025-11-25 22:06:42
2015,2202,Aerospace Engineering,T10597,Nuclear reactor physics and engineering,421,JP,2025-11-25 22:06:42
2015,2202,Aerospace Engineering,T10670,Aluminum Alloy Microstructure Properties,370,JP,2025-11-25 22:06:42
2015,2202,Aerospace Engineering,T12081,Aerodynamics and Fluid Dynamics Research,268,JP,2025-11-25 22:06:42
2015,2202,Aerospace Engineering,T11383,Advanced Antenna and Metasurface Technologies,260,JP,2025-11-25 22:06:42
2015,2202,Aerospace Engineering,T11242,Nuclear Materials and Properties,252,JP,2025-11-25 22:06:42
