year,subfield_id,subfield_name,id,name,works_count,country,fetch_date
2019,3106,Nuclear and High Energy Physics,T10026,"Galaxies: Formation, Evolution, Phenomena",75,CL,2025-11-25 23:03:05
2019,3106,Nuclear and High Energy Physics,T10224,Quantum Chromodynamics and Particle Interactions,66,CL,2025-11-25 23:03:05
2019,3106,Nuclear and High Energy Physics,T11415,Noncommutative and Quantum Gravity Theories,64,CL,2025-11-25 23:03:05
2019,3106,Nuclear and High Energy Physics,T11090,Dark Matter and Cosmic Phenomena,57,CL,2025-11-25 23:03:05
2019,3106,Nuclear and High Energy Physics,T10744,Astrophysical Phenomena and Observations,54,CL,2025-11-25 23:03:05
2019,3106,Nuclear and High Energy Physics,T11323,Gamma-ray bursts and supernovae,53,CL,2025-11-25 23:03:05
2019,3106,Nuclear and High Energy Physics,T10527,High-Energy Particle Collisions Research,51,CL,2025-11-25 23:03:05
2019,3106,Nuclear and High Energy Physics,T10921,Neutrino Physics Research,51,CL,2025-11-25 23:03:05
2019,3106,Nuclear and High Energy Physics,T10463,Pulsars and Gravitational Waves Research,35,CL,2025-11-25 23:03:05
2019,3106,Nuclear and High Energy Physics,T12450,Radio Astronomy Observations and Technology,21,CL,2025-11-25 23:03:05
2019,3106,Nuclear and High Energy Physics,T10039,"Stellar, planetary, and galactic studies",20,CL,2025-11-25 23:03:05
2019,3106,Nuclear and High Energy Physics,T10477,Astrophysics and Star Formation Studies,15,CL,2025-11-25 23:03:05
2019,3106,Nuclear and High Energy Physics,T13458,Astronomical and nuclear sciences,14,CL,2025-11-25 23:03:05
2019,3106,Nuclear and High Energy Physics,T10093,Nuclear physics research studies,13,CL,2025-11-25 23:03:05
2019,3106,Nuclear and High Energy Physics,T12220,Quantum Electrodynamics and Casimir Effect,12,CL,2025-11-25 23:03:05
2019,3106,Nuclear and High Energy Physics,T11960,Relativity and Gravitational Theory,11,CL,2025-11-25 23:03:05
2019,2207,Control and Systems Engineering,T10223,Microgrid Control and Optimization,121,CL,2025-11-25 23:03:05
2019,2207,Control and Systems Engineering,T10876,Fault Detection and Control Systems,69,CL,2025-11-25 23:03:05
2019,2207,Control and Systems Engineering,T10228,Multilevel Inverters and Converters,68,CL,2025-11-25 23:03:05
2019,2207,Control and Systems Engineering,T11110,Stability and Controllability of Differential Equations,56,CL,2025-11-25 23:03:05
2019,2207,Control and Systems Engineering,T10175,Advanced DC-DC Converters,46,CL,2025-11-25 23:03:05
2019,2207,Control and Systems Engineering,T13065,Mining Techniques and Economics,34,CL,2025-11-25 23:03:05
2019,2207,Control and Systems Engineering,T10603,Smart Grid Energy Management,28,CL,2025-11-25 23:03:05
2019,2207,Control and Systems Engineering,T12709,Optimization and Mathematical Programming,25,CL,2025-11-25 23:03:05
2019,2207,Control and Systems Engineering,T10791,Advanced Control Systems Optimization,24,CL,2025-11-25 23:03:05
2019,2207,Control and Systems Engineering,T12282,Mineral Processing and Grinding,24,CL,2025-11-25 23:03:05
2019,2207,Control and Systems Engineering,T11236,Control Systems and Identification,23,CL,2025-11-25 23:03:05
2019,2207,Control and Systems Engineering,T12100,Advanced Mathematical Modeling in Engineering,20,CL,2025-11-25 23:03:05
2019,2207,Control and Systems Engineering,T10524,Traffic control and management,17,CL,2025-11-25 23:03:05
2019,2207,Control and Systems Engineering,T10541,Nonlinear Differential Equations Analysis,16,CL,2025-11-25 23:03:05
2019,2207,Control and Systems Engineering,T13183,Islanding Detection in Power Systems,16,CL,2025-11-25 23:03:05
2019,2207,Control and Systems Engineering,T13341,Belt Conveyor Systems Engineering,14,CL,2025-11-25 23:03:05
2019,2207,Control and Systems Engineering,T10220,Machine Fault Diagnosis Techniques,13,CL,2025-11-25 23:03:05
2019,2207,Control and Systems Engineering,T10468,Photovoltaic System Optimization Techniques,13,CL,2025-11-25 23:03:05
2019,2207,Control and Systems Engineering,T11654,Advanced Mathematical Physics Problems,13,CL,2025-11-25 23:03:05
2019,2207,Control and Systems Engineering,T11053,Process Optimization and Integration,12,CL,2025-11-25 23:03:05
2020,3103,Astronomy and Astrophysics,T10039,"Stellar, planetary, and galactic studies",803,CL,2025-11-25 23:03:05
2020,3103,Astronomy and Astrophysics,T10477,Astrophysics and Star Formation Studies,608,CL,2025-11-25 23:03:05
2020,3103,Astronomy and Astrophysics,T10026,"Galaxies: Formation, Evolution, Phenomena",521,CL,2025-11-25 23:03:05
2020,3103,Astronomy and Astrophysics,T12917,Astronomy and Astrophysical Research,417,CL,2025-11-25 23:03:05
2020,3103,Astronomy and Astrophysics,T11323,Gamma-ray bursts and supernovae,270,CL,2025-11-25 23:03:05
2020,3103,Astronomy and Astrophysics,T10744,Astrophysical Phenomena and Observations,252,CL,2025-11-25 23:03:05
2020,3103,Astronomy and Astrophysics,T10325,Astro and Planetary Science,244,CL,2025-11-25 23:03:05
2020,3103,Astronomy and Astrophysics,T10095,Cosmology and Gravitation Theories,234,CL,2025-11-25 23:03:05
2020,3103,Astronomy and Astrophysics,T10025,Black Holes and Theoretical Physics,158,CL,2025-11-25 23:03:05
2020,3103,Astronomy and Astrophysics,T10818,Astrophysics and Cosmic Phenomena,111,CL,2025-11-25 23:03:05
2020,3103,Astronomy and Astrophysics,T10463,Pulsars and Gravitational Waves Research,89,CL,2025-11-25 23:03:05
2020,3103,Astronomy and Astrophysics,T11484,Adaptive optics and wavefront sensing,86,CL,2025-11-25 23:03:05
2020,3103,Astronomy and Astrophysics,T12450,Radio Astronomy Observations and Technology,65,CL,2025-11-25 23:03:05
2020,3103,Astronomy and Astrophysics,T12967,Molecular Spectroscopy and Structure,64,CL,2025-11-25 23:03:05
2020,3103,Astronomy and Astrophysics,T10251,Solar and Space Plasma Dynamics,53,CL,2025-11-25 23:03:05
2020,3103,Astronomy and Astrophysics,T11415,Noncommutative and Quantum Gravity Theories,52,CL,2025-11-25 23:03:05
2020,3103,Astronomy and Astrophysics,T11320,Atmospheric Ozone and Climate,43,CL,2025-11-25 23:03:05
2020,3103,Astronomy and Astrophysics,T10159,Ionosphere and magnetosphere dynamics,37,CL,2025-11-25 23:03:05
2020,3103,Astronomy and Astrophysics,T10406,Planetary Science and Exploration,27,CL,2025-11-25 23:03:05
2020,3103,Astronomy and Astrophysics,T13080,Advanced Differential Geometry Research,27,CL,2025-11-25 23:03:05
2020,2303,Ecology,T14472,Environmental and Cultural Studies in Latin America and Beyond,232,CL,2025-11-25 23:03:05
2020,2303,Ecology,T10341,Coral and Marine Ecosystems Studies,113,CL,2025-11-25 23:03:05
2020,2303,Ecology,T10199,Wildlife Ecology and Conservation,111,CL,2025-11-25 23:03:05
2020,2303,Ecology,T11791,Microbial Community Ecology and Physiology,105,CL,2025-11-25 23:03:05
2020,2303,Ecology,T10659,Marine animal studies overview,97,CL,2025-11-25 23:03:05
2020,2303,Ecology,T10230,Marine and fisheries research,95,CL,2025-11-25 23:03:05
2020,2303,Ecology,T12180,Polar Research and Ecology,85,CL,2025-11-25 23:03:05
2020,2303,Ecology,T10765,Marine Biology and Ecology Research,81,CL,2025-11-25 23:03:05
2020,2303,Ecology,T12073,Isotope Analysis in Ecology,77,CL,2025-11-25 23:03:05
2020,2303,Ecology,T10643,Marine and coastal plant biology,75,CL,2025-11-25 23:03:05
2020,2303,Ecology,T10577,Hydrology and Sediment Transport Processes,65,CL,2025-11-25 23:03:05
2020,2303,Ecology,T10815,Parasite Biology and Host Interactions,63,CL,2025-11-25 23:03:05
2020,2303,Ecology,T10895,Species Distribution and Climate Change,62,CL,2025-11-25 23:03:05
2020,2303,Ecology,T11913,Animal Ecology and Behavior Studies,62,CL,2025-11-25 23:03:05
2020,2303,Ecology,T10089,Avian ecology and behavior,56,CL,2025-11-25 23:03:05
2020,2303,Ecology,T10005,Ecology and Vegetation Dynamics Studies,54,CL,2025-11-25 23:03:05
2020,2303,Ecology,T11048,Bacteriophages and microbial interactions,54,CL,2025-11-25 23:03:05
2020,2303,Ecology,T10111,Remote Sensing in Agriculture,51,CL,2025-11-25 23:03:05
2020,2303,Ecology,T11691,Forest Insect Ecology and Management,51,CL,2025-11-25 23:03:05
2020,2303,Ecology,T10302,Fish Ecology and Management Studies,48,CL,2025-11-25 23:03:05
2020,2306,Global and Planetary Change,T10230,Marine and fisheries research,158,CL,2025-11-25 23:03:05
2020,2306,Global and Planetary Change,T10266,Plant Water Relations and Carbon Dynamics,115,CL,2025-11-25 23:03:05
2020,2306,Global and Planetary Change,T11088,Marine Bivalve and Aquaculture Studies,113,CL,2025-11-25 23:03:05
2020,2306,Global and Planetary Change,T10029,Climate variability and models,80,CL,2025-11-25 23:03:05
2020,2306,Global and Planetary Change,T10555,Fire effects on ecosystems,75,CL,2025-11-25 23:03:05
2020,2306,Global and Planetary Change,T10226,Land Use and Ecosystem Services,74,CL,2025-11-25 23:03:05
2020,2306,Global and Planetary Change,T10341,Coral and Marine Ecosystems Studies,64,CL,2025-11-25 23:03:05
2020,2306,Global and Planetary Change,T10319,"Conservation, Biodiversity, and Resource Management",63,CL,2025-11-25 23:03:05
2020,2306,Global and Planetary Change,T10930,Flood Risk Assessment and Management,63,CL,2025-11-25 23:03:05
2020,2306,Global and Planetary Change,T11753,Forest Management and Policy,58,CL,2025-11-25 23:03:05
2020,2306,Global and Planetary Change,T10332,Amphibian and Reptile Biology,53,CL,2025-11-25 23:03:05
2020,2306,Global and Planetary Change,T10005,Ecology and Vegetation Dynamics Studies,47,CL,2025-11-25 23:03:05
2020,2306,Global and Planetary Change,T10330,Hydrology and Watershed Management Studies,47,CL,2025-11-25 23:03:05
2020,2306,Global and Planetary Change,T10765,Marine Biology and Ecology Research,45,CL,2025-11-25 23:03:05
2020,2306,Global and Planetary Change,T11594,Tree-ring climate responses,45,CL,2025-11-25 23:03:05
2020,2306,Global and Planetary Change,T11880,Forest ecology and management,40,CL,2025-11-25 23:03:05
2020,2306,Global and Planetary Change,T10644,Cryospheric studies and observations,37,CL,2025-11-25 23:03:05
2020,2306,Global and Planetary Change,T11588,Atmospheric and Environmental Gas Dynamics,37,CL,2025-11-25 23:03:05
2020,2306,Global and Planetary Change,T10466,Meteorological Phenomena and Simulations,36,CL,2025-11-25 23:03:05
2020,2306,Global and Planetary Change,T10895,Species Distribution and Climate Change,34,CL,2025-11-25 23:03:05
2020,2204,Biomedical Engineering,T11073,Metal Extraction and Bioleaching,99,CL,2025-11-25 23:03:05
2020,2204,Biomedical Engineering,T11401,Minerals Flotation and Separation Techniques,56,CL,2025-11-25 23:03:05
2020,2204,Biomedical Engineering,T10157,Sports Performance and Training,46,CL,2025-11-25 23:03:05
2020,2204,Biomedical Engineering,T10171,Biofuel production and bioconversion,46,CL,2025-11-25 23:03:05
2020,2204,Biomedical Engineering,T10402,Phase Equilibria and Thermodynamics,45,CL,2025-11-25 23:03:05
2020,2204,Biomedical Engineering,T11091,Extraction and Separation Processes,45,CL,2025-11-25 23:03:05
2020,2204,Biomedical Engineering,T11018,Lower Extremity Biomechanics and Pathologies,44,CL,2025-11-25 23:03:05
2020,2204,Biomedical Engineering,T11246,Sports injuries and prevention,43,CL,2025-11-25 23:03:05
2020,2204,Biomedical Engineering,T10784,Muscle activation and electromyography studies,42,CL,2025-11-25 23:03:05
2020,2204,Biomedical Engineering,T11667,Advanced Chemical Sensor Technologies,38,CL,2025-11-25 23:03:05
2020,2204,Biomedical Engineering,T12627,Graphene and Nanomaterials Applications,34,CL,2025-11-25 23:03:05
2020,2204,Biomedical Engineering,T10059,Bone Tissue Engineering Materials,32,CL,2025-11-25 23:03:05
2020,2204,Biomedical Engineering,T10338,Advanced Sensor and Energy Harvesting Materials,28,CL,2025-11-25 23:03:05
2020,2204,Biomedical Engineering,T10675,Mechanical Circulatory Support Devices,27,CL,2025-11-25 23:03:05
2020,2204,Biomedical Engineering,T11984,Anatomy and Medical Technology,25,CL,2025-11-25 23:03:05
2020,2204,Biomedical Engineering,T10822,Acoustic Wave Phenomena Research,24,CL,2025-11-25 23:03:05
2020,2204,Biomedical Engineering,T11009,Catalysis for Biomass Conversion,23,CL,2025-11-25 23:03:05
2020,2204,Biomedical Engineering,T11393,Biosensors and Analytical Detection,21,CL,2025-11-25 23:03:05
2020,2204,Biomedical Engineering,T10962,Thermodynamic properties of mixtures,20,CL,2025-11-25 23:03:05
2020,2204,Biomedical Engineering,T12386,Advanced X-ray and CT Imaging,20,CL,2025-11-25 23:03:05
2020,2208,Electrical and Electronic Engineering,T10228,Multilevel Inverters and Converters,153,CL,2025-11-25 23:03:05
2020,2208,Electrical and Electronic Engineering,T10223,Microgrid Control and Optimization,148,CL,2025-11-25 23:03:05
2020,2208,Electrical and Electronic Engineering,T10175,Advanced DC-DC Converters,124,CL,2025-11-25 23:03:05
2020,2208,Electrical and Electronic Engineering,T10603,Smart Grid Energy Management,57,CL,2025-11-25 23:03:05
2020,2208,Electrical and Electronic Engineering,T11102,HVDC Systems and Fault Protection,36,CL,2025-11-25 23:03:05
2020,2208,Electrical and Electronic Engineering,T10361,Silicon Carbide Semiconductor Technologies,35,CL,2025-11-25 23:03:05
2020,2208,Electrical and Electronic Engineering,T10663,Advanced Battery Technologies Research,33,CL,2025-11-25 23:03:05
2020,2208,Electrical and Electronic Engineering,T10212,Electrochemical sensors and biosensors,30,CL,2025-11-25 23:03:05
2020,2208,Electrical and Electronic Engineering,T10454,Optimal Power Flow Distribution,30,CL,2025-11-25 23:03:05
2020,2208,Electrical and Electronic Engineering,T10851,Optical Wireless Communication Technologies,27,CL,2025-11-25 23:03:05
2020,2208,Electrical and Electronic Engineering,T10299,Photonic and Optical Devices,26,CL,2025-11-25 23:03:05
2020,2208,Electrical and Electronic Engineering,T10424,Electric Power System Optimization,25,CL,2025-11-25 23:03:05
2020,2208,Electrical and Electronic Engineering,T10232,Optical Network Technologies,24,CL,2025-11-25 23:03:05
2020,2208,Electrical and Electronic Engineering,T10018,Advancements in Battery Materials,23,CL,2025-11-25 23:03:05
2020,2208,Electrical and Electronic Engineering,T11992,CCD and CMOS Imaging Sensors,23,CL,2025-11-25 23:03:05
2020,2208,Electrical and Electronic Engineering,T10502,Advanced Memory and Neural Computing,22,CL,2025-11-25 23:03:05
2020,2208,Electrical and Electronic Engineering,T10913,Molecular Junctions and Nanostructures,22,CL,2025-11-25 23:03:05
2020,2208,Electrical and Electronic Engineering,T10278,Electric Motor Design and Analysis,21,CL,2025-11-25 23:03:05
2020,2208,Electrical and Electronic Engineering,T10504,Sensorless Control of Electric Motors,21,CL,2025-11-25 23:03:05
2020,2208,Electrical and Electronic Engineering,T10205,Advanced Fiber Optic Sensors,20,CL,2025-11-25 23:03:05
2020,1710,Information Systems,T12395,Educational Innovations and Technology,410,CL,2025-11-25 23:03:05
2020,1710,Information Systems,T14483,Education and Teacher Training,196,CL,2025-11-25 23:03:05
2020,1710,Information Systems,T14246,E-Learning and Knowledge Management,134,CL,2025-11-25 23:03:05
2020,1710,Information Systems,T12338,Digital literacy in education,52,CL,2025-11-25 23:03:05
2020,1710,Information Systems,T12217,Higher Education Teaching and Evaluation,42,CL,2025-11-25 23:03:05
2020,1710,Information Systems,T14498,Educational Technology in Learning,38,CL,2025-11-25 23:03:05
2020,1710,Information Systems,T10260,Software Engineering Research,31,CL,2025-11-25 23:03:05
2020,1710,Information Systems,T13929,Educational Outcomes and Influences,31,CL,2025-11-25 23:03:05
2020,1710,Information Systems,T14071,Healthcare during COVID-19 Pandemic,29,CL,2025-11-25 23:03:05
2020,1710,Information Systems,T10430,Software Engineering Techniques and Practices,27,CL,2025-11-25 23:03:05
2020,1710,Information Systems,T13468,Educational Research and Science Teaching,20,CL,2025-11-25 23:03:05
2020,1710,Information Systems,T14070,Knowledge Societies in the 21st Century,20,CL,2025-11-25 23:03:05
2020,1710,Information Systems,T14271,Educational Methods and Psychological Studies,20,CL,2025-11-25 23:03:05
2020,1710,Information Systems,T14277,Social Skills and Education,19,CL,2025-11-25 23:03:05
2020,1710,Information Systems,T13464,Higher Education and Sustainability,18,CL,2025-11-25 23:03:05
2020,1710,Information Systems,T13979,Communication and COVID-19 Impact,18,CL,2025-11-25 23:03:05
2020,1710,Information Systems,T10270,Blockchain Technology Applications and Security,17,CL,2025-11-25 23:03:05
2020,1710,Information Systems,T10437,Educational theories and practices,17,CL,2025-11-25 23:03:05
2020,1710,Information Systems,T11122,Online Learning and Analytics,17,CL,2025-11-25 23:03:05
2020,1710,Information Systems,T14248,Social impacts of COVID-19,17,CL,2025-11-25 23:03:05
2020,1702,Artificial Intelligence,T12157,Geochemistry and Geologic Mapping,82,CL,2025-11-25 23:03:05
2020,1702,Artificial Intelligence,T10001,Geological and Geochemical Analysis,53,CL,2025-11-25 23:03:05
2020,1702,Artificial Intelligence,T10215,Semantic Web and Ontologies,49,CL,2025-11-25 23:03:05
2020,1702,Artificial Intelligence,T11269,Algorithms and Data Compression,44,CL,2025-11-25 23:03:05
2020,1702,Artificial Intelligence,T10181,Natural Language Processing Techniques,41,CL,2025-11-25 23:03:05
2020,1702,Artificial Intelligence,T10020,Quantum Information and Cryptography,36,CL,2025-11-25 23:03:05
2020,1702,Artificial Intelligence,T10110,earthquake and tectonic studies,32,CL,2025-11-25 23:03:05
2020,1702,Artificial Intelligence,T13018,Seismology and Earthquake Studies,27,CL,2025-11-25 23:03:05
2020,1702,Artificial Intelligence,T10028,Topic Modeling,25,CL,2025-11-25 23:03:05
2020,1702,Artificial Intelligence,T10320,Neural Networks and Applications,25,CL,2025-11-25 23:03:05
2020,1702,Artificial Intelligence,T11901,Bayesian Methods and Mixture Models,25,CL,2025-11-25 23:03:05
2020,1702,Artificial Intelligence,T10317,Advanced Database Systems and Queries,24,CL,2025-11-25 23:03:05
2020,1702,Artificial Intelligence,T10100,Metaheuristic Optimization Algorithms Research,23,CL,2025-11-25 23:03:05
2020,1702,Artificial Intelligence,T11276,Solar Radiation and Photovoltaics,22,CL,2025-11-25 23:03:05
2020,1702,Artificial Intelligence,T13083,Advanced Text Analysis Techniques,22,CL,2025-11-25 23:03:05
2020,1702,Artificial Intelligence,T13623,Linguistic Studies and Language Acquisition,21,CL,2025-11-25 23:03:05
2020,1702,Artificial Intelligence,T11010,"Logic, Reasoning, and Knowledge",20,CL,2025-11-25 23:03:05
2020,1702,Artificial Intelligence,T12262,Hate Speech and Cyberbullying Detection,20,CL,2025-11-25 23:03:05
2020,1702,Artificial Intelligence,T12341,Spanish Linguistics and Language Studies,19,CL,2025-11-25 23:03:05
2020,1702,Artificial Intelligence,T11303,Bayesian Modeling and Causal Inference,18,CL,2025-11-25 23:03:05
2020,2505,Materials Chemistry,T10083,Graphene research and applications,63,CL,2025-11-25 23:03:05
2020,2505,Materials Chemistry,T10079,Nanoparticles: synthesis and applications,46,CL,2025-11-25 23:03:05
2020,2505,Materials Chemistry,T10078,Advanced Photocatalysis Techniques,43,CL,2025-11-25 23:03:05
2020,2505,Materials Chemistry,T10192,Catalytic Processes in Materials Science,37,CL,2025-11-25 23:03:05
2020,2505,Materials Chemistry,T10321,Quantum Dots Synthesis And Properties,31,CL,2025-11-25 23:03:05
2020,2505,Materials Chemistry,T10275,2D Materials and Applications,27,CL,2025-11-25 23:03:05
2020,2505,Materials Chemistry,T12302,Advanced Nanomaterials in Catalysis,25,CL,2025-11-25 23:03:05
2020,2505,Materials Chemistry,T10377,Metal and Thin Film Mechanics,23,CL,2025-11-25 23:03:05
2020,2505,Materials Chemistry,T11907,Copper-based nanomaterials and applications,23,CL,2025-11-25 23:03:05
2020,2505,Materials Chemistry,T12046,MXene and MAX Phase Materials,23,CL,2025-11-25 23:03:05
2020,2505,Materials Chemistry,T10090,ZnO doping and properties,22,CL,2025-11-25 23:03:05
2020,2505,Materials Chemistry,T10024,TiO2 Photocatalysis and Solar Cells,21,CL,2025-11-25 23:03:05
2020,2505,Materials Chemistry,T10478,Diamond and Carbon-based Materials Research,21,CL,2025-11-25 23:03:05
2020,2505,Materials Chemistry,T10657,Topological Materials and Phenomena,21,CL,2025-11-25 23:03:05
2020,2505,Materials Chemistry,T11279,Lanthanide and Transition Metal Complexes,21,CL,2025-11-25 23:03:05
2020,2505,Materials Chemistry,T10310,Corrosion Behavior and Inhibition,20,CL,2025-11-25 23:03:05
2020,2505,Materials Chemistry,T12149,Nanocluster Synthesis and Applications,20,CL,2025-11-25 23:03:05
2020,2505,Materials Chemistry,T12627,Graphene and Nanomaterials Applications,20,CL,2025-11-25 23:03:05
2020,2505,Materials Chemistry,T10903,Porphyrin and Phthalocyanine Chemistry,19,CL,2025-11-25 23:03:05
2020,2505,Materials Chemistry,T10612,Magnetism in coordination complexes,18,CL,2025-11-25 23:03:05
2020,1902,Atmospheric Science,T10644,Cryospheric studies and observations,171,CL,2025-11-25 23:03:05
2020,1902,Atmospheric Science,T10017,Geology and Paleoclimatology Research,157,CL,2025-11-25 23:03:05
2020,1902,Atmospheric Science,T11333,Climate change and permafrost,81,CL,2025-11-25 23:03:05
2020,1902,Atmospheric Science,T11320,Atmospheric Ozone and Climate,66,CL,2025-11-25 23:03:05
2020,1902,Atmospheric Science,T10029,Climate variability and models,63,CL,2025-11-25 23:03:05
2020,1902,Atmospheric Science,T11594,Tree-ring climate responses,54,CL,2025-11-25 23:03:05
2020,1902,Atmospheric Science,T10075,Atmospheric chemistry and aerosols,51,CL,2025-11-25 23:03:05
2020,1902,Atmospheric Science,T10266,Plant Water Relations and Carbon Dynamics,50,CL,2025-11-25 23:03:05
2020,1902,Atmospheric Science,T10466,Meteorological Phenomena and Simulations,43,CL,2025-11-25 23:03:05
2020,1902,Atmospheric Science,T10535,Landslides and related hazards,41,CL,2025-11-25 23:03:05
2020,1902,Atmospheric Science,T11459,Arctic and Antarctic ice dynamics,39,CL,2025-11-25 23:03:05
2020,1902,Atmospheric Science,T10330,Hydrology and Watershed Management Studies,32,CL,2025-11-25 23:03:05
2020,1902,Atmospheric Science,T12180,Polar Research and Ecology,32,CL,2025-11-25 23:03:05
2020,1902,Atmospheric Science,T10001,Geological and Geochemical Analysis,30,CL,2025-11-25 23:03:05
2020,1902,Atmospheric Science,T10477,Astrophysics and Star Formation Studies,28,CL,2025-11-25 23:03:05
2020,1902,Atmospheric Science,T13176,Winter Sports Injuries and Performance,26,CL,2025-11-25 23:03:05
2020,1902,Atmospheric Science,T10965,Geological formations and processes,25,CL,2025-11-25 23:03:05
2020,1902,Atmospheric Science,T10190,Air Quality and Health Impacts,24,CL,2025-11-25 23:03:05
2020,1902,Atmospheric Science,T10347,Atmospheric aerosols and clouds,23,CL,2025-11-25 23:03:05
2020,1902,Atmospheric Science,T10110,earthquake and tectonic studies,22,CL,2025-11-25 23:03:05
2020,3304,Education,T12395,Educational Innovations and Technology,278,CL,2025-11-25 23:03:05
2020,3304,Education,T14483,Education and Teacher Training,211,CL,2025-11-25 23:03:05
2020,3304,Education,T14246,E-Learning and Knowledge Management,90,CL,2025-11-25 23:03:05
2020,3304,Education,T12217,Higher Education Teaching and Evaluation,58,CL,2025-11-25 23:03:05
2020,3304,Education,T13464,Higher Education and Sustainability,35,CL,2025-11-25 23:03:05
2020,3304,Education,T13929,Educational Outcomes and Influences,35,CL,2025-11-25 23:03:05
2020,3304,Education,T10130,Mathematics Education and Teaching Techniques,23,CL,2025-11-25 23:03:05
2020,3304,Education,T13061,Literacy and Educational Practices,23,CL,2025-11-25 23:03:05
2020,3304,Education,T14277,Social Skills and Education,23,CL,2025-11-25 23:03:05
2020,3304,Education,T14498,Educational Technology in Learning,23,CL,2025-11-25 23:03:05
2020,3304,Education,T14271,Educational Methods and Psychological Studies,21,CL,2025-11-25 23:03:05
2020,3304,Education,T10437,Educational theories and practices,20,CL,2025-11-25 23:03:05
2020,3304,Education,T13468,Educational Research and Science Teaching,20,CL,2025-11-25 23:03:05
2020,3304,Education,T12338,Digital literacy in education,19,CL,2025-11-25 23:03:05
2020,3304,Education,T11345,Cognitive and developmental aspects of mathematical skills,18,CL,2025-11-25 23:03:05
2020,3304,Education,T11122,Online Learning and Analytics,17,CL,2025-11-25 23:03:05
2020,3304,Education,T14033,Education in Rural Contexts,17,CL,2025-11-25 23:03:05
2020,3304,Education,T14248,Social impacts of COVID-19,16,CL,2025-11-25 23:03:05
2020,3304,Education,T10162,Online and Blended Learning,13,CL,2025-11-25 23:03:05
2020,3304,Education,T11875,Statistics Education and Methodologies,13,CL,2025-11-25 23:03:05
2021,3103,Astronomy and Astrophysics,T10039,"Stellar, planetary, and galactic studies",761,CL,2025-11-25 23:03:05
2021,3103,Astronomy and Astrophysics,T10477,Astrophysics and Star Formation Studies,625,CL,2025-11-25 23:03:05
2021,3103,Astronomy and Astrophysics,T10026,"Galaxies: Formation, Evolution, Phenomena",486,CL,2025-11-25 23:03:05
2021,3103,Astronomy and Astrophysics,T12917,Astronomy and Astrophysical Research,388,CL,2025-11-25 23:03:05
2021,3103,Astronomy and Astrophysics,T10325,Astro and Planetary Science,282,CL,2025-11-25 23:03:05
2021,3103,Astronomy and Astrophysics,T11323,Gamma-ray bursts and supernovae,242,CL,2025-11-25 23:03:05
2021,3103,Astronomy and Astrophysics,T10744,Astrophysical Phenomena and Observations,241,CL,2025-11-25 23:03:05
2021,3103,Astronomy and Astrophysics,T10095,Cosmology and Gravitation Theories,233,CL,2025-11-25 23:03:05
2021,3103,Astronomy and Astrophysics,T10025,Black Holes and Theoretical Physics,158,CL,2025-11-25 23:03:05
2021,3103,Astronomy and Astrophysics,T10818,Astrophysics and Cosmic Phenomena,117,CL,2025-11-25 23:03:05
2021,3103,Astronomy and Astrophysics,T12967,Molecular Spectroscopy and Structure,82,CL,2025-11-25 23:03:05
2021,3103,Astronomy and Astrophysics,T10463,Pulsars and Gravitational Waves Research,73,CL,2025-11-25 23:03:05
2021,3103,Astronomy and Astrophysics,T10251,Solar and Space Plasma Dynamics,61,CL,2025-11-25 23:03:05
2021,3103,Astronomy and Astrophysics,T11320,Atmospheric Ozone and Climate,55,CL,2025-11-25 23:03:05
2021,3103,Astronomy and Astrophysics,T11415,Noncommutative and Quantum Gravity Theories,55,CL,2025-11-25 23:03:05
