year,subfield_id,subfield_name,id,name,works_count,country,fetch_date
2014,2303,Ecology,T10015,Genomics and Phylogenetic Studies,63,NL,2025-11-25 22:22:50
2014,2303,Ecology,T10889,Soil erosion and sediment transport,62,NL,2025-11-25 22:22:50
2014,2303,Ecology,T10965,Geological formations and processes,60,NL,2025-11-25 22:22:50
2014,1312,Molecular Biology,T10911,Chemical Synthesis and Analysis,103,NL,2025-11-25 22:22:50
2014,1312,Molecular Biology,T10932,Microbial Metabolic Engineering and Bioproduction,102,NL,2025-11-25 22:22:50
2014,1312,Molecular Biology,T10836,Metabolomics and Mass Spectrometry Studies,100,NL,2025-11-25 22:22:50
2014,1312,Molecular Biology,T10015,Genomics and Phylogenetic Studies,91,NL,2025-11-25 22:22:50
2014,1312,Molecular Biology,T10519,Advanced Proteomics Techniques and Applications,87,NL,2025-11-25 22:22:50
2014,1312,Molecular Biology,T10303,Photosynthetic Processes and Mechanisms,83,NL,2025-11-25 22:22:50
2014,1312,Molecular Biology,T11048,Bacteriophages and microbial interactions,83,NL,2025-11-25 22:22:50
2014,1312,Molecular Biology,T11791,Microbial Community Ecology and Physiology,83,NL,2025-11-25 22:22:50
2014,1312,Molecular Biology,T10207,Advanced biosensing and bioanalysis techniques,82,NL,2025-11-25 22:22:50
2014,1312,Molecular Biology,T10404,Enzyme Catalysis and Immobilization,79,NL,2025-11-25 22:22:50
2014,1312,Molecular Biology,T10044,Protein Structure and Dynamics,77,NL,2025-11-25 22:22:50
2014,1312,Molecular Biology,T11710,Biomedical Text Mining and Ontologies,77,NL,2025-11-25 22:22:50
2014,1312,Molecular Biology,T11786,Geomagnetism and Paleomagnetism Studies,77,NL,2025-11-25 22:22:50
2014,1312,Molecular Biology,T10683,Mass Spectrometry Techniques and Applications,76,NL,2025-11-25 22:22:50
2014,1312,Molecular Biology,T10211,Computational Drug Discovery Methods,67,NL,2025-11-25 22:22:50
2014,1312,Molecular Biology,T10407,Lipid Membrane Structure and Behavior,67,NL,2025-11-25 22:22:50
2014,1312,Molecular Biology,T10171,Biofuel production and bioconversion,63,NL,2025-11-25 22:22:50
2014,1312,Molecular Biology,T11162,Enzyme Structure and Function,61,NL,2025-11-25 22:22:50
2014,1312,Molecular Biology,T11177,Spectroscopy and Quantum Chemical Studies,55,NL,2025-11-25 22:22:50
2014,1312,Molecular Biology,T10521,RNA and protein synthesis mechanisms,53,NL,2025-11-25 22:22:50
2014,3107,"Atomic and Molecular Physics, and Optics",T10923,Force Microscopy Techniques and Applications,158,NL,2025-11-25 22:22:50
2014,3107,"Atomic and Molecular Physics, and Optics",T11177,Spectroscopy and Quantum Chemical Studies,152,NL,2025-11-25 22:22:50
2014,3107,"Atomic and Molecular Physics, and Optics",T10382,Quantum and electron transport phenomena,141,NL,2025-11-25 22:22:50
2014,3107,"Atomic and Molecular Physics, and Optics",T10002,Advanced Chemical Physics Studies,117,NL,2025-11-25 22:22:50
2014,3107,"Atomic and Molecular Physics, and Optics",T10049,Magnetic properties of thin films,112,NL,2025-11-25 22:22:50
2014,3107,"Atomic and Molecular Physics, and Optics",T11449,Mechanical and Optical Resonators,112,NL,2025-11-25 22:22:50
2014,3107,"Atomic and Molecular Physics, and Optics",T11993,Atomic and Subatomic Physics Research,106,NL,2025-11-25 22:22:50
2014,3107,"Atomic and Molecular Physics, and Optics",T10299,Photonic and Optical Devices,93,NL,2025-11-25 22:22:50
2014,3107,"Atomic and Molecular Physics, and Optics",T10037,Physics of Superconductivity and Magnetism,80,NL,2025-11-25 22:22:50
2014,3107,"Atomic and Molecular Physics, and Optics",T10666,Photonic Crystals and Applications,78,NL,2025-11-25 22:22:50
2014,3107,"Atomic and Molecular Physics, and Optics",T11484,Adaptive optics and wavefront sensing,77,NL,2025-11-25 22:22:50
2014,3107,"Atomic and Molecular Physics, and Optics",T10622,Quantum Mechanics and Applications,76,NL,2025-11-25 22:22:50
2014,3107,"Atomic and Molecular Physics, and Optics",T10657,Topological Materials and Phenomena,76,NL,2025-11-25 22:22:50
2014,3107,"Atomic and Molecular Physics, and Optics",T10425,Cold Atom Physics and Bose-Einstein Condensates,75,NL,2025-11-25 22:22:50
2014,3107,"Atomic and Molecular Physics, and Optics",T10988,Advanced Fiber Laser Technologies,68,NL,2025-11-25 22:22:50
2014,3107,"Atomic and Molecular Physics, and Optics",T10913,Molecular Junctions and Nanostructures,54,NL,2025-11-25 22:22:50
2014,3107,"Atomic and Molecular Physics, and Optics",T10022,Semiconductor Quantum Structures and Devices,51,NL,2025-11-25 22:22:50
2014,3107,"Atomic and Molecular Physics, and Optics",T10083,Graphene research and applications,51,NL,2025-11-25 22:22:50
2014,3107,"Atomic and Molecular Physics, and Optics",T10020,Quantum Information and Cryptography,49,NL,2025-11-25 22:22:50
2014,3107,"Atomic and Molecular Physics, and Optics",T11804,Quantum many-body systems,48,NL,2025-11-25 22:22:50
2014,2210,Mechanical Engineering,T10635,Hydraulic Fracturing and Reservoir Analysis,205,NL,2025-11-25 22:22:50
2014,2210,Mechanical Engineering,T10672,Design Education and Practice,111,NL,2025-11-25 22:22:50
2014,2210,Mechanical Engineering,T10967,Carbon Dioxide Capture Technologies,98,NL,2025-11-25 22:22:50
2014,2210,Mechanical Engineering,T11801,Reservoir Engineering and Simulation Methods,88,NL,2025-11-25 22:22:50
2014,2210,Mechanical Engineering,T11351,Catalysis and Hydrodesulfurization Studies,74,NL,2025-11-25 22:22:50
2014,2210,Mechanical Engineering,T10892,Drilling and Well Engineering,66,NL,2025-11-25 22:22:50
2014,2210,Mechanical Engineering,T10386,Microstructure and Mechanical Properties of Steels,61,NL,2025-11-25 22:22:50
2014,2210,Mechanical Engineering,T11362,Membrane Separation and Gas Transport,59,NL,2025-11-25 22:22:50
2014,2210,Mechanical Engineering,T11091,Extraction and Separation Processes,58,NL,2025-11-25 22:22:50
2014,2210,Mechanical Engineering,T10491,Enhanced Oil Recovery Techniques,55,NL,2025-11-25 22:22:50
2014,2210,Mechanical Engineering,T10271,Seismic Imaging and Inversion Techniques,53,NL,2025-11-25 22:22:50
2014,2210,Mechanical Engineering,T12784,Modular Robots and Swarm Intelligence,52,NL,2025-11-25 22:22:50
2014,2210,Mechanical Engineering,T10700,Metal Forming Simulation Techniques,39,NL,2025-11-25 22:22:50
2014,2210,Mechanical Engineering,T11737,Advanced Materials and Mechanics,39,NL,2025-11-25 22:22:50
2014,2210,Mechanical Engineering,T12169,Non-Destructive Testing Techniques,39,NL,2025-11-25 22:22:50
2014,2210,Mechanical Engineering,T10399,Hydrocarbon exploration and reservoir analysis,38,NL,2025-11-25 22:22:50
2014,2210,Mechanical Engineering,T12282,Mineral Processing and Grinding,38,NL,2025-11-25 22:22:50
2014,2210,Mechanical Engineering,T10842,Railway Engineering and Dynamics,37,NL,2025-11-25 22:22:50
2014,2210,Mechanical Engineering,T12086,Structural Integrity and Reliability Analysis,37,NL,2025-11-25 22:22:50
2014,2210,Mechanical Engineering,T11009,Catalysis for Biomass Conversion,35,NL,2025-11-25 22:22:50
2015,2204,Biomedical Engineering,T12386,Advanced X-ray and CT Imaging,168,NL,2025-11-25 22:22:50
2015,2204,Biomedical Engineering,T10784,Muscle activation and electromyography studies,156,NL,2025-11-25 22:22:50
2015,2204,Biomedical Engineering,T10171,Biofuel production and bioconversion,151,NL,2025-11-25 22:22:50
2015,2204,Biomedical Engineering,T12015,Photoacoustic and Ultrasonic Imaging,146,NL,2025-11-25 22:22:50
2015,2204,Biomedical Engineering,T11190,3D Printing in Biomedical Research,136,NL,2025-11-25 22:22:50
2015,2204,Biomedical Engineering,T10958,Ultrasound and Hyperthermia Applications,135,NL,2025-11-25 22:22:50
2015,2204,Biomedical Engineering,T11407,Innovative Microfluidic and Catalytic Techniques Innovation,131,NL,2025-11-25 22:22:50
2015,2204,Biomedical Engineering,T11667,Advanced Chemical Sensor Technologies,118,NL,2025-11-25 22:22:50
2015,2204,Biomedical Engineering,T11018,Lower Extremity Biomechanics and Pathologies,111,NL,2025-11-25 22:22:50
2015,2204,Biomedical Engineering,T11009,Catalysis for Biomass Conversion,103,NL,2025-11-25 22:22:50
2015,2204,Biomedical Engineering,T10412,Microfluidic and Capillary Electrophoresis Applications,100,NL,2025-11-25 22:22:50
2015,2204,Biomedical Engineering,T10675,Mechanical Circulatory Support Devices,94,NL,2025-11-25 22:22:50
2015,2204,Biomedical Engineering,T11196,Non-Invasive Vital Sign Monitoring,92,NL,2025-11-25 22:22:50
2015,2204,Biomedical Engineering,T10059,Bone Tissue Engineering Materials,91,NL,2025-11-25 22:22:50
2015,2204,Biomedical Engineering,T10338,Advanced Sensor and Energy Harvesting Materials,86,NL,2025-11-25 22:22:50
2015,2204,Biomedical Engineering,T10782,Nanoplatforms for cancer theranostics,84,NL,2025-11-25 22:22:50
2015,2204,Biomedical Engineering,T11272,Nanowire Synthesis and Applications,80,NL,2025-11-25 22:22:50
2015,2204,Biomedical Engineering,T11255,Microfluidic and Bio-sensing Technologies,78,NL,2025-11-25 22:22:50
2015,2204,Biomedical Engineering,T11569,Optical Coherence Tomography Applications,75,NL,2025-11-25 22:22:50
2015,2204,Biomedical Engineering,T10727,Ultrasound Imaging and Elastography,72,NL,2025-11-25 22:22:50
2015,2208,Electrical and Electronic Engineering,T10299,Photonic and Optical Devices,223,NL,2025-11-25 22:22:50
2015,2208,Electrical and Electronic Engineering,T10472,Semiconductor materials and devices,171,NL,2025-11-25 22:22:50
2015,2208,Electrical and Electronic Engineering,T10603,Smart Grid Energy Management,145,NL,2025-11-25 22:22:50
2015,2208,Electrical and Electronic Engineering,T10623,Thin-Film Transistor Technologies,120,NL,2025-11-25 22:22:50
2015,2208,Electrical and Electronic Engineering,T10232,Optical Network Technologies,113,NL,2025-11-25 22:22:50
2015,2208,Electrical and Electronic Engineering,T10045,Organic Electronics and Photovoltaics,105,NL,2025-11-25 22:22:50
2015,2208,Electrical and Electronic Engineering,T14117,Integrated Circuits and Semiconductor Failure Analysis,99,NL,2025-11-25 22:22:50
2015,2208,Electrical and Electronic Engineering,T10767,Advanced Photonic Communication Systems,96,NL,2025-11-25 22:22:50
2015,2208,Electrical and Electronic Engineering,T10913,Molecular Junctions and Nanostructures,96,NL,2025-11-25 22:22:50
2015,2208,Electrical and Electronic Engineering,T11429,Semiconductor Lasers and Optical Devices,96,NL,2025-11-25 22:22:50
2015,2208,Electrical and Electronic Engineering,T10262,Microwave Engineering and Waveguides,93,NL,2025-11-25 22:22:50
2015,2208,Electrical and Electronic Engineering,T10187,Radio Frequency Integrated Circuit Design,91,NL,2025-11-25 22:22:50
2015,2208,Electrical and Electronic Engineering,T10247,Perovskite Materials and Applications,82,NL,2025-11-25 22:22:50
2015,2208,Electrical and Electronic Engineering,T10558,Advancements in Semiconductor Devices and Circuit Design,79,NL,2025-11-25 22:22:50
2015,2208,Electrical and Electronic Engineering,T10768,Electric Vehicles and Infrastructure,79,NL,2025-11-25 22:22:50
2015,2208,Electrical and Electronic Engineering,T10223,Microgrid Control and Optimization,75,NL,2025-11-25 22:22:50
2015,2208,Electrical and Electronic Engineering,T10502,Advanced Memory and Neural Computing,75,NL,2025-11-25 22:22:50
2015,2208,Electrical and Electronic Engineering,T10590,Chalcogenide Semiconductor Thin Films,75,NL,2025-11-25 22:22:50
2015,2208,Electrical and Electronic Engineering,T10660,Conducting polymers and applications,73,NL,2025-11-25 22:22:50
2015,2208,Electrical and Electronic Engineering,T12776,Electrohydrodynamics and Fluid Dynamics,68,NL,2025-11-25 22:22:50
2015,1702,Artificial Intelligence,T10215,Semantic Web and Ontologies,247,NL,2025-11-25 22:22:50
2015,1702,Artificial Intelligence,T10181,Natural Language Processing Techniques,221,NL,2025-11-25 22:22:50
2015,1702,Artificial Intelligence,T11010,"Logic, Reasoning, and Knowledge",161,NL,2025-11-25 22:22:50
2015,1702,Artificial Intelligence,T10028,Topic Modeling,151,NL,2025-11-25 22:22:50
2015,1702,Artificial Intelligence,T10126,"Logic, programming, and type systems",143,NL,2025-11-25 22:22:50
2015,1702,Artificial Intelligence,T10639,Advanced Software Engineering Methodologies,135,NL,2025-11-25 22:22:50
2015,1702,Artificial Intelligence,T10456,Multi-Agent Systems and Negotiation,131,NL,2025-11-25 22:22:50
2015,1702,Artificial Intelligence,T10679,Service-Oriented Architecture and Web Services,99,NL,2025-11-25 22:22:50
2015,1702,Artificial Intelligence,T11303,Bayesian Modeling and Causal Inference,92,NL,2025-11-25 22:22:50
2015,1702,Artificial Intelligence,T10142,Formal Methods in Verification,89,NL,2025-11-25 22:22:50
2015,1702,Artificial Intelligence,T12031,Speech and dialogue systems,88,NL,2025-11-25 22:22:50
2015,1702,Artificial Intelligence,T10703,Business Process Modeling and Analysis,86,NL,2025-11-25 22:22:50
2015,1702,Artificial Intelligence,T10237,Cryptography and Data Security,78,NL,2025-11-25 22:22:50
2015,1702,Artificial Intelligence,T10020,Quantum Information and Cryptography,74,NL,2025-11-25 22:22:50
2015,1702,Artificial Intelligence,T13083,Advanced Text Analysis Techniques,73,NL,2025-11-25 22:22:50
2015,1702,Artificial Intelligence,T10260,Software Engineering Research,72,NL,2025-11-25 22:22:50
2015,1702,Artificial Intelligence,T12157,Geochemistry and Geologic Mapping,71,NL,2025-11-25 22:22:50
2015,1702,Artificial Intelligence,T10320,Neural Networks and Applications,60,NL,2025-11-25 22:22:50
2015,1702,Artificial Intelligence,T11269,Algorithms and Data Compression,59,NL,2025-11-25 22:22:50
2015,1702,Artificial Intelligence,T11574,Artificial Intelligence in Games,59,NL,2025-11-25 22:22:50
2015,2505,Materials Chemistry,T10192,Catalytic Processes in Materials Science,160,NL,2025-11-25 22:22:50
2015,2505,Materials Chemistry,T10083,Graphene research and applications,136,NL,2025-11-25 22:22:50
2015,2505,Materials Chemistry,T11915,Pickering emulsions and particle stabilization,105,NL,2025-11-25 22:22:50
2015,2505,Materials Chemistry,T10474,Material Dynamics and Properties,99,NL,2025-11-25 22:22:50
2015,2505,Materials Chemistry,T10321,Quantum Dots Synthesis And Properties,87,NL,2025-11-25 22:22:50
2015,2505,Materials Chemistry,T12588,Electronic and Structural Properties of Oxides,80,NL,2025-11-25 22:22:50
2015,2505,Materials Chemistry,T10079,Nanoparticles: synthesis and applications,71,NL,2025-11-25 22:22:50
2015,2505,Materials Chemistry,T11162,Enzyme Structure and Function,65,NL,2025-11-25 22:22:50
2015,2505,Materials Chemistry,T11825,Catalysis and Oxidation Reactions,64,NL,2025-11-25 22:22:50
2015,2505,Materials Chemistry,T10590,Chalcogenide Semiconductor Thin Films,62,NL,2025-11-25 22:22:50
2015,2505,Materials Chemistry,T10735,Mesoporous Materials and Catalysis,62,NL,2025-11-25 22:22:50
2015,2505,Materials Chemistry,T11169,Silicon Nanostructures and Photoluminescence,61,NL,2025-11-25 22:22:50
2015,2505,Materials Chemistry,T11881,Crystallization and Solubility Studies,60,NL,2025-11-25 22:22:50
2015,2505,Materials Chemistry,T10472,Semiconductor materials and devices,59,NL,2025-11-25 22:22:50
2015,2505,Materials Chemistry,T10096,Metal-Organic Frameworks: Synthesis and Applications,58,NL,2025-11-25 22:22:50
2015,2505,Materials Chemistry,T11242,Nuclear Materials and Properties,58,NL,2025-11-25 22:22:50
2015,2505,Materials Chemistry,T11279,Lanthanide and Transition Metal Complexes,58,NL,2025-11-25 22:22:50
2015,2505,Materials Chemistry,T10478,Diamond and Carbon-based Materials Research,55,NL,2025-11-25 22:22:50
2015,2505,Materials Chemistry,T10204,Microstructure and mechanical properties,54,NL,2025-11-25 22:22:50
2015,2505,Materials Chemistry,T10097,Luminescence Properties of Advanced Materials,50,NL,2025-11-25 22:22:50
2015,2306,Global and Planetary Change,T10226,Land Use and Ecosystem Services,281,NL,2025-11-25 22:22:50
2015,2306,Global and Planetary Change,T10930,Flood Risk Assessment and Management,237,NL,2025-11-25 22:22:50
2015,2306,Global and Planetary Change,T11588,Atmospheric and Environmental Gas Dynamics,230,NL,2025-11-25 22:22:50
2015,2306,Global and Planetary Change,T10029,Climate variability and models,208,NL,2025-11-25 22:22:50
2015,2306,Global and Planetary Change,T10266,Plant Water Relations and Carbon Dynamics,206,NL,2025-11-25 22:22:50
2015,2306,Global and Planetary Change,T10119,Sustainability and Climate Change Governance,193,NL,2025-11-25 22:22:50
2015,2306,Global and Planetary Change,T10319,"Conservation, Biodiversity, and Resource Management",168,NL,2025-11-25 22:22:50
2015,2306,Global and Planetary Change,T10230,Marine and fisheries research,132,NL,2025-11-25 22:22:50
2015,2306,Global and Planetary Change,T10075,Atmospheric chemistry and aerosols,129,NL,2025-11-25 22:22:50
2015,2306,Global and Planetary Change,T10330,Hydrology and Watershed Management Studies,126,NL,2025-11-25 22:22:50
2015,2306,Global and Planetary Change,T11320,Atmospheric Ozone and Climate,107,NL,2025-11-25 22:22:50
2015,2306,Global and Planetary Change,T10466,Meteorological Phenomena and Simulations,106,NL,2025-11-25 22:22:50
2015,2306,Global and Planetary Change,T11088,Marine Bivalve and Aquaculture Studies,88,NL,2025-11-25 22:22:50
2015,2306,Global and Planetary Change,T11753,Forest Management and Policy,88,NL,2025-11-25 22:22:50
2015,2306,Global and Planetary Change,T10005,Ecology and Vegetation Dynamics Studies,86,NL,2025-11-25 22:22:50
2015,2306,Global and Planetary Change,T10347,Atmospheric aerosols and clouds,80,NL,2025-11-25 22:22:50
2015,2306,Global and Planetary Change,T11186,Hydrology and Drought Analysis,76,NL,2025-11-25 22:22:50
2015,2306,Global and Planetary Change,T10841,Economic and Environmental Valuation,67,NL,2025-11-25 22:22:50
2015,2306,Global and Planetary Change,T10111,Remote Sensing in Agriculture,62,NL,2025-11-25 22:22:50
2015,2306,Global and Planetary Change,T10555,Fire effects on ecosystems,58,NL,2025-11-25 22:22:50
2015,3103,Astronomy and Astrophysics,T10039,"Stellar, planetary, and galactic studies",501,NL,2025-11-25 22:22:50
2015,3103,Astronomy and Astrophysics,T10477,Astrophysics and Star Formation Studies,493,NL,2025-11-25 22:22:50
2015,3103,Astronomy and Astrophysics,T10026,"Galaxies: Formation, Evolution, Phenomena",448,NL,2025-11-25 22:22:50
2015,3103,Astronomy and Astrophysics,T10744,Astrophysical Phenomena and Observations,298,NL,2025-11-25 22:22:50
2015,3103,Astronomy and Astrophysics,T10325,Astro and Planetary Science,291,NL,2025-11-25 22:22:50
2015,3103,Astronomy and Astrophysics,T12917,Astronomy and Astrophysical Research,279,NL,2025-11-25 22:22:50
2015,3103,Astronomy and Astrophysics,T11323,Gamma-ray bursts and supernovae,255,NL,2025-11-25 22:22:50
2015,3103,Astronomy and Astrophysics,T10818,Astrophysics and Cosmic Phenomena,237,NL,2025-11-25 22:22:50
2015,3103,Astronomy and Astrophysics,T10095,Cosmology and Gravitation Theories,231,NL,2025-11-25 22:22:50
2015,3103,Astronomy and Astrophysics,T12450,Radio Astronomy Observations and Technology,201,NL,2025-11-25 22:22:50
2015,3103,Astronomy and Astrophysics,T10463,Pulsars and Gravitational Waves Research,161,NL,2025-11-25 22:22:50
2015,3103,Astronomy and Astrophysics,T10406,Planetary Science and Exploration,148,NL,2025-11-25 22:22:50
2015,3103,Astronomy and Astrophysics,T10025,Black Holes and Theoretical Physics,137,NL,2025-11-25 22:22:50
2015,3103,Astronomy and Astrophysics,T12967,Molecular Spectroscopy and Structure,107,NL,2025-11-25 22:22:50
2015,3103,Astronomy and Astrophysics,T10159,Ionosphere and magnetosphere dynamics,88,NL,2025-11-25 22:22:50
2015,3103,Astronomy and Astrophysics,T10251,Solar and Space Plasma Dynamics,80,NL,2025-11-25 22:22:50
2015,3103,Astronomy and Astrophysics,T11415,Noncommutative and Quantum Gravity Theories,72,NL,2025-11-25 22:22:50
2015,3103,Astronomy and Astrophysics,T11090,Dark Matter and Cosmic Phenomena,57,NL,2025-11-25 22:22:50
2015,3103,Astronomy and Astrophysics,T11320,Atmospheric Ozone and Climate,51,NL,2025-11-25 22:22:50
2015,3103,Astronomy and Astrophysics,T11803,Superconducting and THz Device Technology,49,NL,2025-11-25 22:22:50
2015,2303,Ecology,T11791,Microbial Community Ecology and Physiology,198,NL,2025-11-25 22:22:50
2015,2303,Ecology,T10779,Coastal wetland ecosystem dynamics,188,NL,2025-11-25 22:22:50
2015,2303,Ecology,T10199,Wildlife Ecology and Conservation,150,NL,2025-11-25 22:22:50
2015,2303,Ecology,T12073,Isotope Analysis in Ecology,149,NL,2025-11-25 22:22:50
2015,2303,Ecology,T10111,Remote Sensing in Agriculture,139,NL,2025-11-25 22:22:50
2015,2303,Ecology,T11048,Bacteriophages and microbial interactions,114,NL,2025-11-25 22:22:50
2015,2303,Ecology,T10341,Coral and Marine Ecosystems Studies,113,NL,2025-11-25 22:22:50
2015,2303,Ecology,T10659,Marine animal studies overview,107,NL,2025-11-25 22:22:50
2015,2303,Ecology,T11259,Agriculture Sustainability and Environmental Impact,101,NL,2025-11-25 22:22:50
2015,2303,Ecology,T10089,Avian ecology and behavior,100,NL,2025-11-25 22:22:50
2015,2303,Ecology,T10577,Hydrology and Sediment Transport Processes,100,NL,2025-11-25 22:22:50
2015,2303,Ecology,T12091,Peatlands and Wetlands Ecology,99,NL,2025-11-25 22:22:50
2015,2303,Ecology,T10895,Species Distribution and Climate Change,90,NL,2025-11-25 22:22:50
2015,2303,Ecology,T10647,Coastal and Marine Dynamics,88,NL,2025-11-25 22:22:50
2015,2303,Ecology,T10005,Ecology and Vegetation Dynamics Studies,82,NL,2025-11-25 22:22:50
2015,2303,Ecology,T10017,Geology and Paleoclimatology Research,82,NL,2025-11-25 22:22:50
2015,2303,Ecology,T10815,Parasite Biology and Host Interactions,75,NL,2025-11-25 22:22:50
2015,2303,Ecology,T10765,Marine Biology and Ecology Research,68,NL,2025-11-25 22:22:50
2015,2303,Ecology,T10230,Marine and fisheries research,67,NL,2025-11-25 22:22:50
2015,2303,Ecology,T10032,Marine and coastal ecosystems,63,NL,2025-11-25 22:22:50
2015,2210,Mechanical Engineering,T10635,Hydraulic Fracturing and Reservoir Analysis,245,NL,2025-11-25 22:22:50
2015,2210,Mechanical Engineering,T11801,Reservoir Engineering and Simulation Methods,114,NL,2025-11-25 22:22:50
2015,2210,Mechanical Engineering,T10967,Carbon Dioxide Capture Technologies,97,NL,2025-11-25 22:22:50
2015,2210,Mechanical Engineering,T11351,Catalysis and Hydrodesulfurization Studies,86,NL,2025-11-25 22:22:50
2015,2210,Mechanical Engineering,T10892,Drilling and Well Engineering,81,NL,2025-11-25 22:22:50
2015,2210,Mechanical Engineering,T10672,Design Education and Practice,78,NL,2025-11-25 22:22:50
2015,2210,Mechanical Engineering,T10271,Seismic Imaging and Inversion Techniques,75,NL,2025-11-25 22:22:50
2015,2210,Mechanical Engineering,T12784,Modular Robots and Swarm Intelligence,67,NL,2025-11-25 22:22:50
2015,2210,Mechanical Engineering,T10491,Enhanced Oil Recovery Techniques,62,NL,2025-11-25 22:22:50
2015,2210,Mechanical Engineering,T11091,Extraction and Separation Processes,61,NL,2025-11-25 22:22:50
2015,2210,Mechanical Engineering,T10386,Microstructure and Mechanical Properties of Steels,59,NL,2025-11-25 22:22:50
2015,2210,Mechanical Engineering,T11362,Membrane Separation and Gas Transport,59,NL,2025-11-25 22:22:50
2015,2210,Mechanical Engineering,T10842,Railway Engineering and Dynamics,50,NL,2025-11-25 22:22:50
2015,2210,Mechanical Engineering,T12169,Non-Destructive Testing Techniques,46,NL,2025-11-25 22:22:50
2015,2210,Mechanical Engineering,T11583,Advanced Measurement and Metrology Techniques,41,NL,2025-11-25 22:22:50
2015,2210,Mechanical Engineering,T11138,Tribology and Lubrication Engineering,39,NL,2025-11-25 22:22:50
2015,2210,Mechanical Engineering,T10204,Microstructure and mechanical properties,38,NL,2025-11-25 22:22:50
2015,2210,Mechanical Engineering,T10399,Hydrocarbon exploration and reservoir analysis,38,NL,2025-11-25 22:22:50
2015,2210,Mechanical Engineering,T11372,Hydraulic and Pneumatic Systems,38,NL,2025-11-25 22:22:50
2015,2210,Mechanical Engineering,T11737,Advanced Materials and Mechanics,36,NL,2025-11-25 22:22:50
2015,3107,"Atomic and Molecular Physics, and Optics",T10382,Quantum and electron transport phenomena,137,NL,2025-11-25 22:22:50
2015,3107,"Atomic and Molecular Physics, and Optics",T11177,Spectroscopy and Quantum Chemical Studies,137,NL,2025-11-25 22:22:50
2015,3107,"Atomic and Molecular Physics, and Optics",T10002,Advanced Chemical Physics Studies,130,NL,2025-11-25 22:22:50
2015,3107,"Atomic and Molecular Physics, and Optics",T10923,Force Microscopy Techniques and Applications,115,NL,2025-11-25 22:22:50
2015,3107,"Atomic and Molecular Physics, and Optics",T11993,Atomic and Subatomic Physics Research,108,NL,2025-11-25 22:22:50
2015,3107,"Atomic and Molecular Physics, and Optics",T10299,Photonic and Optical Devices,104,NL,2025-11-25 22:22:50
2015,3107,"Atomic and Molecular Physics, and Optics",T11449,Mechanical and Optical Resonators,102,NL,2025-11-25 22:22:50
2015,3107,"Atomic and Molecular Physics, and Optics",T10425,Cold Atom Physics and Bose-Einstein Condensates,82,NL,2025-11-25 22:22:50
2015,3107,"Atomic and Molecular Physics, and Optics",T10666,Photonic Crystals and Applications,82,NL,2025-11-25 22:22:50
2015,3107,"Atomic and Molecular Physics, and Optics",T10657,Topological Materials and Phenomena,78,NL,2025-11-25 22:22:50
2015,3107,"Atomic and Molecular Physics, and Optics",T10988,Advanced Fiber Laser Technologies,78,NL,2025-11-25 22:22:50
2015,3107,"Atomic and Molecular Physics, and Optics",T10037,Physics of Superconductivity and Magnetism,74,NL,2025-11-25 22:22:50
2015,3107,"Atomic and Molecular Physics, and Optics",T10049,Magnetic properties of thin films,74,NL,2025-11-25 22:22:50
2015,3107,"Atomic and Molecular Physics, and Optics",T10622,Quantum Mechanics and Applications,71,NL,2025-11-25 22:22:50
2015,3107,"Atomic and Molecular Physics, and Optics",T10083,Graphene research and applications,69,NL,2025-11-25 22:22:50
2015,3107,"Atomic and Molecular Physics, and Optics",T10523,Atomic and Molecular Physics,68,NL,2025-11-25 22:22:50
2015,3107,"Atomic and Molecular Physics, and Optics",T10020,Quantum Information and Cryptography,63,NL,2025-11-25 22:22:50
2015,3107,"Atomic and Molecular Physics, and Optics",T11965,"Quantum, superfluid, helium dynamics",57,NL,2025-11-25 22:22:50
