year,subfield_id,subfield_name,id,name,works_count,country,fetch_date
2020,1312,Molecular Biology,T10836,Metabolomics and Mass Spectrometry Studies,165,NL,2025-11-25 22:22:50
2020,1312,Molecular Biology,T11791,Microbial Community Ecology and Physiology,157,NL,2025-11-25 22:22:50
2020,1312,Molecular Biology,T10211,Computational Drug Discovery Methods,129,NL,2025-11-25 22:22:50
2020,1312,Molecular Biology,T10932,Microbial Metabolic Engineering and Bioproduction,126,NL,2025-11-25 22:22:50
2020,1312,Molecular Biology,T11048,Bacteriophages and microbial interactions,115,NL,2025-11-25 22:22:50
2020,1312,Molecular Biology,T10171,Biofuel production and bioconversion,113,NL,2025-11-25 22:22:50
2020,1312,Molecular Biology,T10207,Advanced biosensing and bioanalysis techniques,100,NL,2025-11-25 22:22:50
2020,1312,Molecular Biology,T11786,Geomagnetism and Paleomagnetism Studies,100,NL,2025-11-25 22:22:50
2020,1312,Molecular Biology,T10683,Mass Spectrometry Techniques and Applications,95,NL,2025-11-25 22:22:50
2020,1312,Molecular Biology,T10519,Advanced Proteomics Techniques and Applications,94,NL,2025-11-25 22:22:50
2020,1312,Molecular Biology,T10044,Protein Structure and Dynamics,90,NL,2025-11-25 22:22:50
2020,1312,Molecular Biology,T11710,Biomedical Text Mining and Ontologies,88,NL,2025-11-25 22:22:50
2020,1312,Molecular Biology,T10303,Photosynthetic Processes and Mechanisms,86,NL,2025-11-25 22:22:50
2020,1312,Molecular Biology,T10602,Glycosylation and Glycoproteins Research,81,NL,2025-11-25 22:22:50
2020,1312,Molecular Biology,T10911,Chemical Synthesis and Analysis,79,NL,2025-11-25 22:22:50
2020,1312,Molecular Biology,T10404,Enzyme Catalysis and Immobilization,75,NL,2025-11-25 22:22:50
2020,1312,Molecular Biology,T10407,Lipid Membrane Structure and Behavior,73,NL,2025-11-25 22:22:50
2020,1312,Molecular Biology,T10835,Carbohydrate Chemistry and Synthesis,71,NL,2025-11-25 22:22:50
2020,1312,Molecular Biology,T11190,3D Printing in Biomedical Research,71,NL,2025-11-25 22:22:50
2020,2210,Mechanical Engineering,T10635,Hydraulic Fracturing and Reservoir Analysis,170,NL,2025-11-25 22:22:50
2020,2210,Mechanical Engineering,T10672,Design Education and Practice,126,NL,2025-11-25 22:22:50
2020,2210,Mechanical Engineering,T12784,Modular Robots and Swarm Intelligence,126,NL,2025-11-25 22:22:50
2020,2210,Mechanical Engineering,T11737,Advanced Materials and Mechanics,113,NL,2025-11-25 22:22:50
2020,2210,Mechanical Engineering,T10967,Carbon Dioxide Capture Technologies,100,NL,2025-11-25 22:22:50
2020,2210,Mechanical Engineering,T11351,Catalysis and Hydrodesulfurization Studies,83,NL,2025-11-25 22:22:50
2020,2210,Mechanical Engineering,T11362,Membrane Separation and Gas Transport,71,NL,2025-11-25 22:22:50
2020,2210,Mechanical Engineering,T11091,Extraction and Separation Processes,70,NL,2025-11-25 22:22:50
2020,2210,Mechanical Engineering,T10783,Additive Manufacturing and 3D Printing Technologies,64,NL,2025-11-25 22:22:50
2020,2210,Mechanical Engineering,T10386,Microstructure and Mechanical Properties of Steels,60,NL,2025-11-25 22:22:50
2020,2210,Mechanical Engineering,T11801,Reservoir Engineering and Simulation Methods,60,NL,2025-11-25 22:22:50
2020,2210,Mechanical Engineering,T12169,Non-Destructive Testing Techniques,59,NL,2025-11-25 22:22:50
2020,2210,Mechanical Engineering,T10842,Railway Engineering and Dynamics,58,NL,2025-11-25 22:22:50
2020,2210,Mechanical Engineering,T10705,Additive Manufacturing Materials and Processes,56,NL,2025-11-25 22:22:50
2020,2210,Mechanical Engineering,T12086,Structural Integrity and Reliability Analysis,56,NL,2025-11-25 22:22:50
2020,2210,Mechanical Engineering,T10892,Drilling and Well Engineering,54,NL,2025-11-25 22:22:50
2020,2210,Mechanical Engineering,T11372,Hydraulic and Pneumatic Systems,54,NL,2025-11-25 22:22:50
2020,2210,Mechanical Engineering,T10271,Seismic Imaging and Inversion Techniques,52,NL,2025-11-25 22:22:50
2020,2210,Mechanical Engineering,T10495,Catalysts for Methane Reforming,49,NL,2025-11-25 22:22:50
2020,2210,Mechanical Engineering,T11486,Micro and Nano Robotics,47,NL,2025-11-25 22:22:50
2021,1702,Artificial Intelligence,T10028,Topic Modeling,409,NL,2025-11-25 22:22:50
2021,1702,Artificial Intelligence,T10181,Natural Language Processing Techniques,343,NL,2025-11-25 22:22:50
2021,1702,Artificial Intelligence,T10215,Semantic Web and Ontologies,203,NL,2025-11-25 22:22:50
2021,1702,Artificial Intelligence,T10020,Quantum Information and Cryptography,187,NL,2025-11-25 22:22:50
2021,1702,Artificial Intelligence,T10682,Quantum Computing Algorithms and Architecture,166,NL,2025-11-25 22:22:50
2021,1702,Artificial Intelligence,T10862,AI in cancer detection,165,NL,2025-11-25 22:22:50
2021,1702,Artificial Intelligence,T11512,Anomaly Detection Techniques and Applications,163,NL,2025-11-25 22:22:50
2021,1702,Artificial Intelligence,T10764,Privacy-Preserving Technologies in Data,153,NL,2025-11-25 22:22:50
2021,1702,Artificial Intelligence,T11307,Domain Adaptation and Few-Shot Learning,151,NL,2025-11-25 22:22:50
2021,1702,Artificial Intelligence,T11010,"Logic, Reasoning, and Knowledge",149,NL,2025-11-25 22:22:50
2021,1702,Artificial Intelligence,T13702,Machine Learning in Healthcare,147,NL,2025-11-25 22:22:50
2021,1702,Artificial Intelligence,T10462,Reinforcement Learning in Robotics,141,NL,2025-11-25 22:22:50
2021,1702,Artificial Intelligence,T11689,Adversarial Robustness in Machine Learning,140,NL,2025-11-25 22:22:50
2021,1702,Artificial Intelligence,T10320,Neural Networks and Applications,136,NL,2025-11-25 22:22:50
2021,1702,Artificial Intelligence,T12535,Machine Learning and Data Classification,132,NL,2025-11-25 22:22:50
2021,1702,Artificial Intelligence,T10126,"Logic, programming, and type systems",130,NL,2025-11-25 22:22:50
2021,1702,Artificial Intelligence,T12157,Geochemistry and Geologic Mapping,129,NL,2025-11-25 22:22:50
2021,1702,Artificial Intelligence,T12262,Hate Speech and Cyberbullying Detection,126,NL,2025-11-25 22:22:50
2021,1702,Artificial Intelligence,T12026,Explainable Artificial Intelligence (XAI),124,NL,2025-11-25 22:22:50
2021,1702,Artificial Intelligence,T10237,Cryptography and Data Security,122,NL,2025-11-25 22:22:50
2021,2204,Biomedical Engineering,T11190,3D Printing in Biomedical Research,282,NL,2025-11-25 22:22:50
2021,2204,Biomedical Engineering,T10784,Muscle activation and electromyography studies,237,NL,2025-11-25 22:22:50
2021,2204,Biomedical Engineering,T10675,Mechanical Circulatory Support Devices,232,NL,2025-11-25 22:22:50
2021,2204,Biomedical Engineering,T12386,Advanced X-ray and CT Imaging,228,NL,2025-11-25 22:22:50
2021,2204,Biomedical Engineering,T11667,Advanced Chemical Sensor Technologies,181,NL,2025-11-25 22:22:50
2021,2204,Biomedical Engineering,T12015,Photoacoustic and Ultrasonic Imaging,174,NL,2025-11-25 22:22:50
2021,2204,Biomedical Engineering,T10171,Biofuel production and bioconversion,165,NL,2025-11-25 22:22:50
2021,2204,Biomedical Engineering,T11407,Innovative Microfluidic and Catalytic Techniques Innovation,165,NL,2025-11-25 22:22:50
2021,2204,Biomedical Engineering,T10059,Bone Tissue Engineering Materials,161,NL,2025-11-25 22:22:50
2021,2204,Biomedical Engineering,T11018,Lower Extremity Biomechanics and Pathologies,156,NL,2025-11-25 22:22:50
2021,2204,Biomedical Engineering,T11196,Non-Invasive Vital Sign Monitoring,155,NL,2025-11-25 22:22:50
2021,2204,Biomedical Engineering,T10338,Advanced Sensor and Energy Harvesting Materials,149,NL,2025-11-25 22:22:50
2021,2204,Biomedical Engineering,T10782,Nanoplatforms for cancer theranostics,149,NL,2025-11-25 22:22:50
2021,2204,Biomedical Engineering,T10958,Ultrasound and Hyperthermia Applications,137,NL,2025-11-25 22:22:50
2021,2204,Biomedical Engineering,T11255,Microfluidic and Bio-sensing Technologies,109,NL,2025-11-25 22:22:50
2021,2204,Biomedical Engineering,T12598,Cardiac Structural Anomalies and Repair,106,NL,2025-11-25 22:22:50
2021,2204,Biomedical Engineering,T11393,Biosensors and Analytical Detection,105,NL,2025-11-25 22:22:50
2021,2204,Biomedical Engineering,T10522,Medical Imaging Techniques and Applications,103,NL,2025-11-25 22:22:50
2021,2204,Biomedical Engineering,T10645,Cardiac Arrest and Resuscitation,101,NL,2025-11-25 22:22:50
2021,2204,Biomedical Engineering,T10412,Microfluidic and Capillary Electrophoresis Applications,100,NL,2025-11-25 22:22:50
2021,2208,Electrical and Electronic Engineering,T10299,Photonic and Optical Devices,249,NL,2025-11-25 22:22:50
2021,2208,Electrical and Electronic Engineering,T10603,Smart Grid Energy Management,203,NL,2025-11-25 22:22:50
2021,2208,Electrical and Electronic Engineering,T10247,Perovskite Materials and Applications,193,NL,2025-11-25 22:22:50
2021,2208,Electrical and Electronic Engineering,T10502,Advanced Memory and Neural Computing,187,NL,2025-11-25 22:22:50
2021,2208,Electrical and Electronic Engineering,T10232,Optical Network Technologies,151,NL,2025-11-25 22:22:50
2021,2208,Electrical and Electronic Engineering,T10472,Semiconductor materials and devices,151,NL,2025-11-25 22:22:50
2021,2208,Electrical and Electronic Engineering,T10767,Advanced Photonic Communication Systems,143,NL,2025-11-25 22:22:50
2021,2208,Electrical and Electronic Engineering,T10768,Electric Vehicles and Infrastructure,130,NL,2025-11-25 22:22:50
2021,2208,Electrical and Electronic Engineering,T10223,Microgrid Control and Optimization,126,NL,2025-11-25 22:22:50
2021,2208,Electrical and Electronic Engineering,T11185,Integrated Energy Systems Optimization,124,NL,2025-11-25 22:22:50
2021,2208,Electrical and Electronic Engineering,T10913,Molecular Junctions and Nanostructures,122,NL,2025-11-25 22:22:50
2021,2208,Electrical and Electronic Engineering,T10262,Microwave Engineering and Waveguides,120,NL,2025-11-25 22:22:50
2021,2208,Electrical and Electronic Engineering,T10590,Chalcogenide Semiconductor Thin Films,114,NL,2025-11-25 22:22:50
2021,2208,Electrical and Electronic Engineering,T10663,Advanced Battery Technologies Research,105,NL,2025-11-25 22:22:50
2021,2208,Electrical and Electronic Engineering,T14117,Integrated Circuits and Semiconductor Failure Analysis,100,NL,2025-11-25 22:22:50
2021,2208,Electrical and Electronic Engineering,T11690,Advanced battery technologies research,96,NL,2025-11-25 22:22:50
2021,2208,Electrical and Electronic Engineering,T10558,Advancements in Semiconductor Devices and Circuit Design,91,NL,2025-11-25 22:22:50
2021,2208,Electrical and Electronic Engineering,T10187,Radio Frequency Integrated Circuit Design,90,NL,2025-11-25 22:22:50
2021,2208,Electrical and Electronic Engineering,T10321,Quantum Dots Synthesis And Properties,88,NL,2025-11-25 22:22:50
2021,2208,Electrical and Electronic Engineering,T10409,Fuel Cells and Related Materials,88,NL,2025-11-25 22:22:50
2021,2306,Global and Planetary Change,T11588,Atmospheric and Environmental Gas Dynamics,582,NL,2025-11-25 22:22:50
2021,2306,Global and Planetary Change,T10930,Flood Risk Assessment and Management,475,NL,2025-11-25 22:22:50
2021,2306,Global and Planetary Change,T10226,Land Use and Ecosystem Services,411,NL,2025-11-25 22:22:50
2021,2306,Global and Planetary Change,T10029,Climate variability and models,405,NL,2025-11-25 22:22:50
2021,2306,Global and Planetary Change,T10119,Sustainability and Climate Change Governance,320,NL,2025-11-25 22:22:50
2021,2306,Global and Planetary Change,T10330,Hydrology and Watershed Management Studies,275,NL,2025-11-25 22:22:50
2021,2306,Global and Planetary Change,T10075,Atmospheric chemistry and aerosols,274,NL,2025-11-25 22:22:50
2021,2306,Global and Planetary Change,T10266,Plant Water Relations and Carbon Dynamics,252,NL,2025-11-25 22:22:50
2021,2306,Global and Planetary Change,T11320,Atmospheric Ozone and Climate,242,NL,2025-11-25 22:22:50
2021,2306,Global and Planetary Change,T10319,"Conservation, Biodiversity, and Resource Management",226,NL,2025-11-25 22:22:50
2021,2306,Global and Planetary Change,T10466,Meteorological Phenomena and Simulations,207,NL,2025-11-25 22:22:50
2021,2306,Global and Planetary Change,T10347,Atmospheric aerosols and clouds,188,NL,2025-11-25 22:22:50
2021,2306,Global and Planetary Change,T11186,Hydrology and Drought Analysis,167,NL,2025-11-25 22:22:50
2021,2306,Global and Planetary Change,T10555,Fire effects on ecosystems,164,NL,2025-11-25 22:22:50
2021,2306,Global and Planetary Change,T10230,Marine and fisheries research,152,NL,2025-11-25 22:22:50
2021,2306,Global and Planetary Change,T11088,Marine Bivalve and Aquaculture Studies,111,NL,2025-11-25 22:22:50
2021,2306,Global and Planetary Change,T10111,Remote Sensing in Agriculture,109,NL,2025-11-25 22:22:50
2021,2306,Global and Planetary Change,T13377,Ecosystem dynamics and resilience,99,NL,2025-11-25 22:22:50
2021,2306,Global and Planetary Change,T11963,Impact of Light on Environment and Health,96,NL,2025-11-25 22:22:50
2021,2306,Global and Planetary Change,T10005,Ecology and Vegetation Dynamics Studies,90,NL,2025-11-25 22:22:50
2021,2303,Ecology,T10779,Coastal wetland ecosystem dynamics,311,NL,2025-11-25 22:22:50
2021,2303,Ecology,T11259,Agriculture Sustainability and Environmental Impact,282,NL,2025-11-25 22:22:50
2021,2303,Ecology,T11791,Microbial Community Ecology and Physiology,273,NL,2025-11-25 22:22:50
2021,2303,Ecology,T10111,Remote Sensing in Agriculture,232,NL,2025-11-25 22:22:50
2021,2303,Ecology,T11048,Bacteriophages and microbial interactions,217,NL,2025-11-25 22:22:50
2021,2303,Ecology,T10199,Wildlife Ecology and Conservation,204,NL,2025-11-25 22:22:50
2021,2303,Ecology,T12073,Isotope Analysis in Ecology,193,NL,2025-11-25 22:22:50
2021,2303,Ecology,T10341,Coral and Marine Ecosystems Studies,156,NL,2025-11-25 22:22:50
2021,2303,Ecology,T10647,Coastal and Marine Dynamics,151,NL,2025-11-25 22:22:50
2021,2303,Ecology,T10577,Hydrology and Sediment Transport Processes,146,NL,2025-11-25 22:22:50
2021,2303,Ecology,T10659,Marine animal studies overview,141,NL,2025-11-25 22:22:50
2021,2303,Ecology,T10017,Geology and Paleoclimatology Research,139,NL,2025-11-25 22:22:50
2021,2303,Ecology,T10015,Genomics and Phylogenetic Studies,122,NL,2025-11-25 22:22:50
2021,2303,Ecology,T10895,Species Distribution and Climate Change,122,NL,2025-11-25 22:22:50
2021,2303,Ecology,T12091,Peatlands and Wetlands Ecology,122,NL,2025-11-25 22:22:50
2021,2303,Ecology,T10089,Avian ecology and behavior,119,NL,2025-11-25 22:22:50
2021,2303,Ecology,T10765,Marine Biology and Ecology Research,97,NL,2025-11-25 22:22:50
2021,2303,Ecology,T10643,Marine and coastal plant biology,91,NL,2025-11-25 22:22:50
2021,2303,Ecology,T10815,Parasite Biology and Host Interactions,88,NL,2025-11-25 22:22:50
2021,2303,Ecology,T10226,Land Use and Ecosystem Services,84,NL,2025-11-25 22:22:50
2021,3103,Astronomy and Astrophysics,T10039,"Stellar, planetary, and galactic studies",653,NL,2025-11-25 22:22:50
2021,3103,Astronomy and Astrophysics,T10026,"Galaxies: Formation, Evolution, Phenomena",510,NL,2025-11-25 22:22:50
2021,3103,Astronomy and Astrophysics,T10477,Astrophysics and Star Formation Studies,504,NL,2025-11-25 22:22:50
2021,3103,Astronomy and Astrophysics,T10325,Astro and Planetary Science,458,NL,2025-11-25 22:22:50
2021,3103,Astronomy and Astrophysics,T11323,Gamma-ray bursts and supernovae,368,NL,2025-11-25 22:22:50
2021,3103,Astronomy and Astrophysics,T12917,Astronomy and Astrophysical Research,353,NL,2025-11-25 22:22:50
2021,3103,Astronomy and Astrophysics,T10818,Astrophysics and Cosmic Phenomena,348,NL,2025-11-25 22:22:50
2021,3103,Astronomy and Astrophysics,T10744,Astrophysical Phenomena and Observations,337,NL,2025-11-25 22:22:50
2021,3103,Astronomy and Astrophysics,T10463,Pulsars and Gravitational Waves Research,312,NL,2025-11-25 22:22:50
2021,3103,Astronomy and Astrophysics,T10095,Cosmology and Gravitation Theories,269,NL,2025-11-25 22:22:50
2021,3103,Astronomy and Astrophysics,T12450,Radio Astronomy Observations and Technology,255,NL,2025-11-25 22:22:50
2021,3103,Astronomy and Astrophysics,T10406,Planetary Science and Exploration,216,NL,2025-11-25 22:22:50
2021,3103,Astronomy and Astrophysics,T10251,Solar and Space Plasma Dynamics,169,NL,2025-11-25 22:22:50
2021,3103,Astronomy and Astrophysics,T10159,Ionosphere and magnetosphere dynamics,136,NL,2025-11-25 22:22:50
2021,3103,Astronomy and Astrophysics,T10025,Black Holes and Theoretical Physics,125,NL,2025-11-25 22:22:50
2021,3103,Astronomy and Astrophysics,T12967,Molecular Spectroscopy and Structure,111,NL,2025-11-25 22:22:50
2021,3103,Astronomy and Astrophysics,T12788,Space Science and Extraterrestrial Life,99,NL,2025-11-25 22:22:50
2021,3103,Astronomy and Astrophysics,T11090,Dark Matter and Cosmic Phenomena,88,NL,2025-11-25 22:22:50
2021,3103,Astronomy and Astrophysics,T11320,Atmospheric Ozone and Climate,81,NL,2025-11-25 22:22:50
2021,3103,Astronomy and Astrophysics,T11405,Geophysics and Gravity Measurements,81,NL,2025-11-25 22:22:50
2021,2505,Materials Chemistry,T10192,Catalytic Processes in Materials Science,182,NL,2025-11-25 22:22:50
2021,2505,Materials Chemistry,T10247,Perovskite Materials and Applications,140,NL,2025-11-25 22:22:50
2021,2505,Materials Chemistry,T11915,Pickering emulsions and particle stabilization,138,NL,2025-11-25 22:22:50
2021,2505,Materials Chemistry,T11948,Machine Learning in Materials Science,131,NL,2025-11-25 22:22:50
2021,2505,Materials Chemistry,T10083,Graphene research and applications,114,NL,2025-11-25 22:22:50
2021,2505,Materials Chemistry,T10321,Quantum Dots Synthesis And Properties,111,NL,2025-11-25 22:22:50
2021,2505,Materials Chemistry,T10275,2D Materials and Applications,106,NL,2025-11-25 22:22:50
2021,2505,Materials Chemistry,T12588,Electronic and Structural Properties of Oxides,104,NL,2025-11-25 22:22:50
2021,2505,Materials Chemistry,T10474,Material Dynamics and Properties,93,NL,2025-11-25 22:22:50
2021,2505,Materials Chemistry,T11162,Enzyme Structure and Function,87,NL,2025-11-25 22:22:50
2021,2505,Materials Chemistry,T10590,Chalcogenide Semiconductor Thin Films,81,NL,2025-11-25 22:22:50
2021,2505,Materials Chemistry,T11825,Catalysis and Oxidation Reactions,80,NL,2025-11-25 22:22:50
2021,2505,Materials Chemistry,T10079,Nanoparticles: synthesis and applications,78,NL,2025-11-25 22:22:50
2021,2505,Materials Chemistry,T10478,Diamond and Carbon-based Materials Research,77,NL,2025-11-25 22:22:50
2021,2505,Materials Chemistry,T10592,Fusion materials and technologies,69,NL,2025-11-25 22:22:50
2021,2505,Materials Chemistry,T11708,Photochromic and Fluorescence Chemistry,69,NL,2025-11-25 22:22:50
2021,2505,Materials Chemistry,T10078,Advanced Photocatalysis Techniques,67,NL,2025-11-25 22:22:50
2021,2505,Materials Chemistry,T11878,Solid-state spectroscopy and crystallography,62,NL,2025-11-25 22:22:50
2021,2505,Materials Chemistry,T10310,Corrosion Behavior and Inhibition,61,NL,2025-11-25 22:22:50
2021,2505,Materials Chemistry,T10495,Catalysts for Methane Reforming,61,NL,2025-11-25 22:22:50
2021,1902,Atmospheric Science,T10017,Geology and Paleoclimatology Research,559,NL,2025-11-25 22:22:50
2021,1902,Atmospheric Science,T10644,Cryospheric studies and observations,457,NL,2025-11-25 22:22:50
2021,1902,Atmospheric Science,T11320,Atmospheric Ozone and Climate,401,NL,2025-11-25 22:22:50
2021,1902,Atmospheric Science,T10075,Atmospheric chemistry and aerosols,383,NL,2025-11-25 22:22:50
2021,1902,Atmospheric Science,T11588,Atmospheric and Environmental Gas Dynamics,350,NL,2025-11-25 22:22:50
2021,1902,Atmospheric Science,T10466,Meteorological Phenomena and Simulations,299,NL,2025-11-25 22:22:50
2021,1902,Atmospheric Science,T10029,Climate variability and models,248,NL,2025-11-25 22:22:50
2021,1902,Atmospheric Science,T11333,Climate change and permafrost,234,NL,2025-11-25 22:22:50
2021,1902,Atmospheric Science,T11483,Tropical and Extratropical Cyclones Research,169,NL,2025-11-25 22:22:50
2021,1902,Atmospheric Science,T11459,Arctic and Antarctic ice dynamics,167,NL,2025-11-25 22:22:50
2021,1902,Atmospheric Science,T10347,Atmospheric aerosols and clouds,159,NL,2025-11-25 22:22:50
2021,1902,Atmospheric Science,T11234,Precipitation Measurement and Analysis,137,NL,2025-11-25 22:22:50
2021,1902,Atmospheric Science,T10535,Landslides and related hazards,111,NL,2025-11-25 22:22:50
2021,1902,Atmospheric Science,T10930,Flood Risk Assessment and Management,100,NL,2025-11-25 22:22:50
2021,1902,Atmospheric Science,T10330,Hydrology and Watershed Management Studies,97,NL,2025-11-25 22:22:50
2021,1902,Atmospheric Science,T10965,Geological formations and processes,92,NL,2025-11-25 22:22:50
2021,1902,Atmospheric Science,T11312,Soil Moisture and Remote Sensing,89,NL,2025-11-25 22:22:50
2021,1902,Atmospheric Science,T13176,Winter Sports Injuries and Performance,87,NL,2025-11-25 22:22:50
2021,1902,Atmospheric Science,T10995,Methane Hydrates and Related Phenomena,85,NL,2025-11-25 22:22:50
2021,1902,Atmospheric Science,T10647,Coastal and Marine Dynamics,82,NL,2025-11-25 22:22:50
2021,1312,Molecular Biology,T10836,Metabolomics and Mass Spectrometry Studies,159,NL,2025-11-25 22:22:50
2021,1312,Molecular Biology,T10015,Genomics and Phylogenetic Studies,158,NL,2025-11-25 22:22:50
2021,1312,Molecular Biology,T11791,Microbial Community Ecology and Physiology,146,NL,2025-11-25 22:22:50
2021,1312,Molecular Biology,T10207,Advanced biosensing and bioanalysis techniques,125,NL,2025-11-25 22:22:50
2021,1312,Molecular Biology,T10211,Computational Drug Discovery Methods,125,NL,2025-11-25 22:22:50
2021,1312,Molecular Biology,T10932,Microbial Metabolic Engineering and Bioproduction,120,NL,2025-11-25 22:22:50
2021,1312,Molecular Biology,T11048,Bacteriophages and microbial interactions,117,NL,2025-11-25 22:22:50
2021,1312,Molecular Biology,T11786,Geomagnetism and Paleomagnetism Studies,110,NL,2025-11-25 22:22:50
2021,1312,Molecular Biology,T10044,Protein Structure and Dynamics,107,NL,2025-11-25 22:22:50
2021,1312,Molecular Biology,T10683,Mass Spectrometry Techniques and Applications,87,NL,2025-11-25 22:22:50
2021,1312,Molecular Biology,T11710,Biomedical Text Mining and Ontologies,82,NL,2025-11-25 22:22:50
2021,1312,Molecular Biology,T10911,Chemical Synthesis and Analysis,78,NL,2025-11-25 22:22:50
2021,1312,Molecular Biology,T10171,Biofuel production and bioconversion,76,NL,2025-11-25 22:22:50
2021,1312,Molecular Biology,T10303,Photosynthetic Processes and Mechanisms,76,NL,2025-11-25 22:22:50
2021,1312,Molecular Biology,T10602,Glycosylation and Glycoproteins Research,73,NL,2025-11-25 22:22:50
2021,1312,Molecular Biology,T10519,Advanced Proteomics Techniques and Applications,72,NL,2025-11-25 22:22:50
2021,1312,Molecular Biology,T10404,Enzyme Catalysis and Immobilization,71,NL,2025-11-25 22:22:50
2021,1312,Molecular Biology,T10887,Bioinformatics and Genomic Networks,71,NL,2025-11-25 22:22:50
2021,1312,Molecular Biology,T11162,Enzyme Structure and Function,70,NL,2025-11-25 22:22:50
2021,1312,Molecular Biology,T10407,Lipid Membrane Structure and Behavior,64,NL,2025-11-25 22:22:50
2021,2210,Mechanical Engineering,T10635,Hydraulic Fracturing and Reservoir Analysis,172,NL,2025-11-25 22:22:50
2021,2210,Mechanical Engineering,T10967,Carbon Dioxide Capture Technologies,135,NL,2025-11-25 22:22:50
2021,2210,Mechanical Engineering,T10672,Design Education and Practice,122,NL,2025-11-25 22:22:50
2021,2210,Mechanical Engineering,T11737,Advanced Materials and Mechanics,120,NL,2025-11-25 22:22:50
2021,2210,Mechanical Engineering,T12784,Modular Robots and Swarm Intelligence,106,NL,2025-11-25 22:22:50
2021,2210,Mechanical Engineering,T11362,Membrane Separation and Gas Transport,81,NL,2025-11-25 22:22:50
2021,2210,Mechanical Engineering,T10892,Drilling and Well Engineering,72,NL,2025-11-25 22:22:50
2021,2210,Mechanical Engineering,T11091,Extraction and Separation Processes,72,NL,2025-11-25 22:22:50
2021,2210,Mechanical Engineering,T11351,Catalysis and Hydrodesulfurization Studies,69,NL,2025-11-25 22:22:50
2021,2210,Mechanical Engineering,T10783,Additive Manufacturing and 3D Printing Technologies,59,NL,2025-11-25 22:22:50
2021,2210,Mechanical Engineering,T10705,Additive Manufacturing Materials and Processes,58,NL,2025-11-25 22:22:50
2021,2210,Mechanical Engineering,T12169,Non-Destructive Testing Techniques,56,NL,2025-11-25 22:22:50
2021,2210,Mechanical Engineering,T10386,Microstructure and Mechanical Properties of Steels,53,NL,2025-11-25 22:22:50
2021,2210,Mechanical Engineering,T10842,Railway Engineering and Dynamics,52,NL,2025-11-25 22:22:50
2021,2210,Mechanical Engineering,T11801,Reservoir Engineering and Simulation Methods,51,NL,2025-11-25 22:22:50
2021,2210,Mechanical Engineering,T11372,Hydraulic and Pneumatic Systems,48,NL,2025-11-25 22:22:50
2021,2210,Mechanical Engineering,T11486,Micro and Nano Robotics,48,NL,2025-11-25 22:22:50
2021,2210,Mechanical Engineering,T10271,Seismic Imaging and Inversion Techniques,47,NL,2025-11-25 22:22:50
2021,2210,Mechanical Engineering,T10338,Advanced Sensor and Energy Harvesting Materials,45,NL,2025-11-25 22:22:50
2021,2210,Mechanical Engineering,T11201,Metallurgy and Material Forming,40,NL,2025-11-25 22:22:50
2022,2204,Biomedical Engineering,T11190,3D Printing in Biomedical Research,283,NL,2025-11-25 22:22:50
2022,2204,Biomedical Engineering,T10675,Mechanical Circulatory Support Devices,241,NL,2025-11-25 22:22:50
2022,2204,Biomedical Engineering,T12386,Advanced X-ray and CT Imaging,234,NL,2025-11-25 22:22:50
2022,2204,Biomedical Engineering,T11667,Advanced Chemical Sensor Technologies,184,NL,2025-11-25 22:22:50
2022,2204,Biomedical Engineering,T10784,Muscle activation and electromyography studies,181,NL,2025-11-25 22:22:50
2022,2204,Biomedical Engineering,T10171,Biofuel production and bioconversion,178,NL,2025-11-25 22:22:50
2022,2204,Biomedical Engineering,T12015,Photoacoustic and Ultrasonic Imaging,173,NL,2025-11-25 22:22:50
2022,2204,Biomedical Engineering,T11407,Innovative Microfluidic and Catalytic Techniques Innovation,156,NL,2025-11-25 22:22:50
2022,2204,Biomedical Engineering,T10338,Advanced Sensor and Energy Harvesting Materials,150,NL,2025-11-25 22:22:50
